299,NCES,,,26.0,1.71E+11,0,0,0,0,0,0,0,0,0,AUDUBON ELEMENTARY SCHOOL,AUDUBON ELEMENTARY SCHOOL,AUDUBON ELEMENTARY SCHOOL,3500 NORTH HOYNE AV,3500 NORTH HOYNE AV,3500 NORTH HOYNE AV,CHICAGO,IL,60618,"3500 NORTH HOYNE AVE, CHICAGO, IL 60618",508,508.0,,,1,1,1,1,1,1,1,1,1,1,1,1,1,1,1,1,ES,"3500, North Hoyne Avenue, Hamlin Park, North Center, Chicago, Cook County, Illinois, 60618, United States of America","41.9454416, -87.68150587483606",41.9454416,-87.681505874836,POINT (443510.9737883518 4643943.262473891),0,0,0,0,0,144,0,0,0,0,0,0,0,0,0,0,0,0,0,,1340 N Larrabee St,"1340 N Larrabee St, Chicago, IL",Chicago,IL,William Green Homes,"1340, North Larrabee Street, Chicago River North, Near North Side, Chicago, Cook County, Illinois, 60610, United States of America","41.90564317650747, -87.64338600864538",41.90564318,-87.64338601,5432.964085989041
300,NCES,,,122.0,1.71E+11,0,0,0,0,0,0,0,0,0,CLAY ELEMENTARY SCHOOL,CLAY ELEMENTARY SCHOOL,CLAY ELEMENTARY SCHOOL,13231 SOUTH BURLEY AV,13231 SOUTH BURLEY AV,13231 SOUTH BURLEY AV,CHICAGO,IL,60633,"13231 SOUTH BURLEY AVE, CHICAGO, IL 60633",5501,5501.0,,,1,1,1,1,1,1,1,1,1,1,1,1,1,1,1,1,ES,"13231, South Burley Avenue, Hegewisch, Chicago, Cook County, Illinois, 60633, United States of America","41.65470335, -87.5440954216725",41.65470335,-87.5440954216725,POINT (454696.4467128761 4611582.460904919),0,0,0,0,0,12,0,0,0,0,0,0,0,0,0,0,0,0,0,,3841 S Vincennes Av,"3841 S Vincennes Av, Chicago, IL",Chicago,IL,Ida B. Wells Homes,"South Vincennes Avenue, Park Manor, Greater Grand Crossing, Chicago, Cook County, Illinois, 60620, United States of America","41.7674384, -87.6270546",41.767438399999996,-87.6270546,14293.277827024182
301,NCES,,,473.0,1.71E+11,0,0,0,0,0,0,0,0,0,PARKSIDE ELEMENTARY COMMUNITY ACADEMY,PARKSIDE ELEMENTARY COMMUNITY ACADEMY,PARKSIDE ELEMENTARY COMMUNITY ACADEMY,6938 SOUTH EAST END AV,6938 SOUTH EAST END AV,6938 SOUTH EAST END AV,CHICAGO,IL,60649,"6938 SOUTH EAST END AVE, CHICAGO, IL 60649",4302,4302.0,,,1,1,1,1,1,1,1,1,1,1,1,1,1,1,1,1,ES,"6938, South East End Avenue, Parkside, South Shore, Chicago, Cook County, Illinois, 60649, United States of America","41.76890245, -87.58330667860173",41.76890245,-87.5833066786017,POINT (451517.4379603099 4624282.644224844),0,0,0,0,0,12,0,0,0,0,0,0,0,0,0,0,0,0,0,,3740 S Cottage Grove Ave,"3740 S Cottage Grove Ave, Chicago, IL",Chicago,IL,Ida B. Wells Homes,"South Cottage Grove Avenue, Washington Park, Chicago, Cook County, Illinois, 60637, United States of America","41.7862906, -87.6060534",41.7862906,-87.60605340000001,2702.004776187234
302,NCES,,,368.0,1.71E+11,0,0,0,0,0,0,0,0,0,LINCOLN ELEMENTARY SCHOOL,LINCOLN ELEMENTARY SCHOOL,LINCOLN ELEMENTARY SCHOOL,615 WEST KEMPER PL,615 WEST KEMPER PL,615 WEST KEMPER PL,CHICAGO,IL,60614,"615 WEST KEMPER PL, CHICAGO, IL 60614",712,712.0,,,1,1,1,1,1,1,1,1,1,1,1,1,1,1,1,1,ES,"615, West Kemper Place, Lincoln Park, Chicago, Cook County, Illinois, 60614, United States of America","41.92439055, -87.64479905272422",41.92439055,-87.6447990527242,POINT (446535.9841253115 4641582.459086707),0,0,0,0,0,144,0,0,0,0,0,0,0,0,0,0,0,0,0,,1340 N Larrabee St,"1340 N Larrabee St, Chicago, IL",Chicago,IL,William Green Homes,"1340, North Larrabee Street, Chicago River North, Near North Side, Chicago, Cook County, Illinois, 60610, United States of America","41.90564317650747, -87.64338600864538",41.90564318,-87.64338601,2084.83715190701
303,NCES,,,20.0,1.71E+11,0,0,0,0,0,0,0,0,0,ARMOUR ELEMENTARY SCHOOL,ARMOUR ELEMENTARY SCHOOL,ARMOUR ELEMENTARY SCHOOL,950 WEST 33RD PL,950 WEST 33RD PL,950 WEST 33RD PL,CHICAGO,IL,60608,"950 WEST 33RD PL, CHICAGO, IL 60608",6008,8397.0,,,1,1,1,1,1,1,1,1,1,1,1,1,1,1,1,1,ES,"Armour Elementary School, 928-950, West 33rd Place, Bridgeport, Chicago, Cook County, Illinois, 60608, United States of America","41.8340525, -87.6500715",41.8340525,-87.6500715,POINT (446022.8416886169 4631555.76990893),0,0,0,0,0,18,0,0,0,0,0,0,0,0,0,0,0,0,0,,3757 S Princeton Ave,"3757 S Princeton Ave, Chicago, IL",Chicago,IL,Wentworth Gardens,"3757, South Princeton Avenue, Armour Square, Chicago, Cook County, Illinois, 60609, United States of America","41.8259264, -87.63370933333333",41.8259264,-87.63370933,1631.0004763264533
304,NCES,,,261.0,1.71E+11,0,0,0,0,0,0,0,0,0,HAMMOND ELEMENTARY SCHOOL,HAMMOND ELEMENTARY SCHOOL,HAMMOND ELEMENTARY SCHOOL,2819 WEST 21ST PL,2819 WEST 21ST PL,2819 WEST 21ST PL,CHICAGO,IL,60623,"2819 WEST 21ST PL, CHICAGO, IL 60623",3002,8407.0,,,1,1,1,1,1,1,1,1,1,1,1,1,1,1,1,1,ES,"Hammond Elementary School, 2817-2819, West 21st Place, Bohemian California, South Lawndale, Chicago, Cook County, Illinois, 60623, United States of America","41.8525575, -87.6960327",41.8525575,-87.6960327,POINT (442223.1918680381 4633640.221457841),0,18,0,0,0,0,0,0,0,0,0,0,0,0,0,0,0,0,0,,1331 S Washtenaw Av,"1331 S Washtenaw Av, Chicago, IL",Chicago,IL,Lawndale Complex,"1331, South Washtenaw Avenue, North Lawndale, Chicago, Cook County, Illinois, 60608, United States of America","41.86398200909429, -87.69322792261676",41.86398201,-87.69322792,1289.658196739026
305,NCES,,,442.0,1.71E+11,1,0,0,0,0,0,0,0,0,NEWBERRY ELEMENTARY MATH & SCIENCE ACADEMY,NEWBERRY ELEMENTARY MATH & SCIENCE ACADEMY,NEWBERRY ELEMENTARY MATH & SCIENCE ACADEMY,700 WEST WILLOW ST,700 WEST WILLOW ST,700 WEST WILLOW ST,CHICAGO,IL,60614,"700 WEST WILLOW ST, CHICAGO, IL 60614",718,718.0,,,1,1,1,1,1,1,1,1,1,1,1,1,1,1,1,1,ES,"700, West Willow Street, Lincoln Park, Chicago, Cook County, Illinois, 60614, United States of America","41.913945, -87.64612",41.913945,-87.64612,POINT (446417.7184364217 4640423.534406628),0,0,0,0,0,144,0,0,0,0,0,0,0,0,0,0,0,0,0,,1340 N Larrabee St,"1340 N Larrabee St, Chicago, IL",Chicago,IL,William Green Homes,"1340, North Larrabee Street, Chicago River North, Near North Side, Chicago, Cook County, Illinois, 60610, United States of America","41.90564317650747, -87.64338600864538",41.90564318,-87.64338601,949.2397486765491
306,NCES,,,430.0,1.71E+11,0,0,0,0,0,0,0,0,0,MURPHY ELEMENTARY SCHOOL,MURPHY ELEMENTARY SCHOOL,MURPHY ELEMENTARY SCHOOL,3539 WEST GRACE ST,3539 WEST GRACE ST,3539 WEST GRACE ST,CHICAGO,IL,60618,"3539 WEST GRACE ST, CHICAGO, IL 60618",1608,1608.0,,,1,1,1,1,1,1,1,1,1,1,1,1,1,1,1,1,ES,"3539, West Grace Street, Irving Park, Chicago, Cook County, Illinois, 60618, United States of America","41.94962065, -87.71708374912436",41.94962065,-87.7170837491243,POINT (440565.8414567188 4644431.316836262),0,0,0,0,0,0,134,0,0,0,0,0,0,0,0,0,0,0,0,,714 W Division St,"714 W Division St, Chicago, IL",Chicago,IL,William Green Homes,"West Division Street, Moreland, Austin, Chicago, Cook County, Illinois, 60651, United States of America","41.9024164, -87.7424231",41.9024164,-87.7424231,5646.652877317634
307,NCES,,,425.0,1.71E+11,0,0,0,0,0,0,0,0,0,MOUNT GREENWOOD ELEMENTARY SCHOOL,MOUNT GREENWOOD ELEMENTARY SCHOOL,MOUNT GREENWOOD ELEMENTARY SCHOOL,10841 SOUTH HOMAN AV,10841 SOUTH HOMAN AV,10841 SOUTH HOMAN AV,CHICAGO,IL,60655,"10841 SOUTH HOMAN AVE, CHICAGO, IL 60655",7403,7403.0,,,1,1,1,1,1,1,1,1,1,1,1,1,1,1,1,1,ES,"South Homan Avenue, East Garfield Park, Chicago, Cook County, Illinois, 60623, United States of America","41.8778076, -87.7109073",41.8778076,-87.7109073,POINT (441011.678356671 4636453.784478812),0,0,0,75,0,0,0,0,0,0,0,0,0,0,0,0,0,0,0,,1224 W Roosevelt Rd,"1224 W Roosevelt Rd, Chicago, IL",Chicago,IL,Jane Addams Homes,"West Roosevelt Road, North Lawndale, Chicago, Cook County, Illinois, 60624, United States of America","41.8662079, -87.7225376",41.8662079,-87.7225376,1609.4412010838803
308,NCES,,,3.0,1.71E+11,0,0,0,0,0,0,0,0,0,AGASSIZ ELEMENTARY SCHOOL,AGASSIZ ELEMENTARY SCHOOL,AGASSIZ ELEMENTARY SCHOOL,2851 NORTH SEMINARY AV,2851 NORTH SEMINARY AV,2851 NORTH SEMINARY AV,CHICAGO,IL,60657,"2851 NORTH SEMINARY AVE, CHICAGO, IL 60657",629,629.0,,,1,1,1,1,1,1,1,1,1,1,1,1,1,1,1,1,ES,"2851, North Seminary Avenue, Wrigleyville, Lake View, Chicago, Cook County, Illinois, 60657, United States of America","41.9339628, -87.65587952603124",41.9339628,-87.65587952603121,POINT (445625.3635444266 4642652.217456745),0,0,0,0,0,144,0,0,0,0,0,0,0,0,0,0,0,0,0,,1340 N Larrabee St,"1340 N Larrabee St, Chicago, IL",Chicago,IL,William Green Homes,"1340, North Larrabee Street, Chicago River North, Near North Side, Chicago, Cook County, Illinois, 60610, United States of America","41.90564317650747, -87.64338600864538",41.90564318,-87.64338601,3310.6425492466283
309,NCES,,,606.0,1.71E+11,0,0,0,0,0,0,0,0,0,TILTON ELEMENTARY SCHOOL,TILTON ELEMENTARY SCHOOL,TILTON ELEMENTARY SCHOOL,223 NORTH KEELER AV,223 NORTH KEELER AV,223 NORTH KEELER AV,CHICAGO,IL,60624,"223 NORTH KEELER AVE, CHICAGO, IL 60624",2602,2602.0,,,1,1,1,1,1,1,1,1,1,1,1,1,1,1,1,1,ES,"223, North Keeler Avenue, Central Park, West Garfield Park, Chicago, Cook County, Illinois, 60624, United States of America","41.8837652, -87.7302477806376",41.8837652,-87.73024778063758,POINT (439412.4993431417 4637128.715758722),0,0,0,75,0,0,0,0,0,0,0,0,0,0,0,0,0,0,0,,1224 W Roosevelt Rd,"1224 W Roosevelt Rd, Chicago, IL",Chicago,IL,Jane Addams Homes,"West Roosevelt Road, North Lawndale, Chicago, Cook County, Illinois, 60624, United States of America","41.8662079, -87.7225376",41.8662079,-87.7225376,2051.723497899154
310,NCES,,,222.0,1.71E+11,1,0,0,0,0,0,0,0,0,GALILEO ELEMENTARY MATH & SCI SCHOOLOL ACD,GALILEO ELEMENTARY MATH & SCI SCHOOL ACD,GALILEO ELEMENTARY MATH & SCI SCHOOLOL ACD,820 SOUTH CARPENTER ST,820 SOUTH CARPENTER ST,820 SOUTH CARPENTER ST,CHICAGO,IL,60607,"820 SOUTH CARPENTER ST, CHICAGO, IL 60607",2822,8333.0,,,1,1,1,1,1,1,1,1,1,1,1,1,1,1,1,1,ES,"820, South Carpenter Street, Greektown, Near West Side, Chicago, Cook County, Illinois, 60607, United States of America","41.87105885, -87.65348579905398",41.87105885,-87.6534857990539,POINT (445770.6102259059 4635666.6176105),0,0,0,30,0,0,0,0,0,0,0,0,0,0,0,0,0,0,0,,844 S Racine Av,"844 S Racine Av, Chicago, IL",Chicago,IL,Jane Addams Homes,"844, South Racine Avenue, Greektown, Near West Side, Chicago, Cook County, Illinois, 60607, United States of America","41.87093666175098, -87.65691320736968",41.87093666,-87.65691321,284.7563249631833
311,NCES,,,570.0,1.71E+11,1,0,0,0,0,0,0,0,0,SOUTH LOOP ELEMENTARY SCHOOL,SOUTH LOOP ELEMENTARY SCHOOL,SOUTH LOOP ELEMENTARY SCHOOL,1212 SOUTH PLYMOUTH CT,1212 SOUTH PLYMOUTH CT,1212 SOUTH PLYMOUTH CT,CHICAGO,IL,60605,"1212 SOUTH PLYMOUTH CT, CHICAGO, IL 60605",3302,3302.0,,,1,1,1,1,1,1,1,1,1,1,1,1,1,1,1,1,ES,"1212, South Plymouth Court, Dearborn Park, Near South Side, Chicago, Cook County, Illinois, 60605, United States of America","41.86679095, -87.62901209335027",41.86679095,-87.6290120933502,POINT (447798.0929118492 4635177.593151713),0,0,0,21,0,0,0,0,0,0,0,0,0,0,0,0,0,0,0,,1240 W Roosevelt Rd,"1240 W Roosevelt Rd, Chicago, IL",Chicago,IL,Jane Addams Homes,"West Roosevelt Road, Greektown, Near West Side, Chicago, Cook County, Illinois, 60607, United States of America","41.8672794, -87.6423234",41.8672794,-87.64232340000001,1106.0709682746722
312,NCES,,,73.0,1.71E+11,0,0,0,0,0,0,0,0,0,BYFORD ELEMENTARY SCHOOL,BRUNSON MATH & SCI SPECIALTY ELEMENTARY,BRUNSON MATH & SCI SPECIALTY ELEMENTARY,5600 WEST IOWA ST,932 NORTH CENTRAL AV,932 NORTH CENTRAL AV,CHICAGO,IL,60651,"932 NORTH CENTRAL AVE, CHICAGO, IL 60651",2513,2513.0,,,1,1,1,1,1,1,1,1,1,1,1,1,1,1,1,1,ES,"Brunson Elementary School, 932, North Central Avenue, Austin, Chicago, Cook County, Illinois, 60630, United States of America","41.8975992, -87.7658808",41.8975992,-87.7658808,POINT (436469.7750590382 4638690.446226385),0,0,0,0,0,0,134,0,0,0,0,0,0,0,0,0,0,0,0,,714 W Division St,"714 W Division St, Chicago, IL",Chicago,IL,William Green Homes,"West Division Street, Moreland, Austin, Chicago, Cook County, Illinois, 60651, United States of America","41.9024164, -87.7424231",41.9024164,-87.7424231,2018.0152252786913
313,NCES,,,357.0,1.71E+11,0,0,0,0,0,0,0,0,0,LARA ELEMENTARY ACADEMY,LARA ELEMENTARY ACADEMY,LARA ELEMENTARY ACADEMY,4619 SOUTH WOLCOTT AV,4619 SOUTH WOLCOTT AV,4619 SOUTH WOLCOTT AV,CHICAGO,IL,60609,"4619 SOUTH WOLCOTT AVE, CHICAGO, IL 60609",6103,6103.0,,,1,1,1,1,1,1,1,1,1,1,1,1,1,1,1,1,ES,"4619, South Wolcott Avenue, Back of the Yards, New City, Chicago, Cook County, Illinois, 60609, United States of America","41.80972665, -87.67191524902704",41.80972665,-87.67191524902702,POINT (444187.9672667149 4628868.918457104),0,0,0,0,0,2,0,0,0,0,0,0,0,0,0,0,0,0,0,,6238 S Hermitage Av,"6238 S Hermitage Av, Chicago, IL",Chicago,IL,Scattered Site Housing,"6238, South Hermitage Avenue, West Englewood, Chicago, Cook County, Illinois, 60636, United States of America","41.78068588307552, -87.66799468539163",41.78068588,-87.66799469,3240.7833479245514
314,NCES,,,,1.71E+11,0,0,0,0,0,0,0,0,0,NANCY JEFFERSON ELEMENTARY ALT SCHOOL,JEFFERSON ALT HIGH SCHOOL,JEFFERSON ALT HIGH SCHOOL,1100 SOUTH HAMILTON AV,1100 SOUTH HAMILTON AV,1100 SOUTH HAMILTON AV,CHICAGO,IL,60612,"1100 SOUTH HAMILTON AVE, CHICAGO, IL 60612",2830,8382.0,,,1,1,1,1,1,1,1,1,1,1,0,1,1,1,1,1,HS,"1100, South Hamilton Avenue, Claremont Cottages, Near West Side, Illinois Medical District, Cook County, Illinois, 60612, United States of America","41.86747883098592, -87.68040694366196",41.86747883098591,-87.6804069436619,POINT (443533.4023652137 4635286.496393838),0,18,0,0,0,0,0,0,0,0,0,0,0,0,0,0,0,0,0,,2635 W 12th Pl,"2635 W 12th Pl, Chicago, IL",Chicago,IL,Lawndale Complex,"2635, West 12th Place, North Lawndale, Chicago, Cook County, Illinois, 60608, United States of America","41.86557306122449, -87.69264230612245",41.86557306,-87.69264231,1037.2713234675787
315,NCES,,,66.0,1.71E+11,0,0,0,0,0,0,0,0,0,BRIGHT ELEMENTARY SCHOOL,BRIGHT ELEMENTARY SCHOOL,BRIGHT ELEMENTARY SCHOOL,10740 SOUTH CALHOUN AV,10740 SOUTH CALHOUN AV,10740 SOUTH CALHOUN AV,CHICAGO,IL,60617,"10740 SOUTH CALHOUN AVE, CHICAGO, IL 60617",5105,8388.0,,,1,1,1,1,1,1,1,1,1,1,1,1,1,1,1,1,ES,"10740, South Calhoun Avenue, Trumbull Park Terrace, South Deering, Chicago, Cook County, Illinois, 60617, United States of America","41.699815799999996, -87.56233164214163",41.699815799999904,-87.56233164214159,POINT (453210.7074493519 4616600.73513332),0,0,0,0,0,12,0,0,0,0,0,0,0,0,0,0,0,0,0,,3841 S Vincennes Av,"3841 S Vincennes Av, Chicago, IL",Chicago,IL,Ida B. Wells Homes,"South Vincennes Avenue, Park Manor, Greater Grand Crossing, Chicago, Cook County, Illinois, 60620, United States of America","41.7674384, -87.6270546",41.767438399999996,-87.6270546,9238.080446740192
316,NCES,,,403.0,1.71E+11,0,0,0,0,0,0,0,0,0,MCCUTCHEON ELEMENTARY SCHOOL,MCCUTCHEON ELEMENTARY SCHOOL,MCCUTCHEON ELEMENTARY SCHOOL,4865 NORTH SHERIDAN RD,4865 NORTH SHERIDAN RD,4865 NORTH SHERIDAN RD,CHICAGO,IL,60640,"4865 NORTH SHERIDAN RD, CHICAGO, IL 60640",313,313.0,,,1,1,1,1,1,1,1,1,1,1,1,1,1,1,1,1,ES,"4865, North Sheridan Road, Uptown Retail, Uptown, Chicago, Cook County, Illinois, 60640, United States of America","41.9711924, -87.6544735926868",41.9711924,-87.65447359268681,POINT (445773.4870273673 4646784.881469488),0,0,0,0,0,144,0,0,0,0,0,0,0,0,0,0,0,0,0,,1340 N Larrabee St,"1340 N Larrabee St, Chicago, IL",Chicago,IL,William Green Homes,"1340, North Larrabee Street, Chicago River North, Near North Side, Chicago, Cook County, Illinois, 60610, United States of America","41.90564317650747, -87.64338600864538",41.90564318,-87.64338601,7335.848103050989
317,NCES,,,383.0,1.71E+11,0,0,0,0,0,0,0,0,0,MADISON ELEMENTARY SCHOOL,MADISON ELEMENTARY SCHOOL,MADISON ELEMENTARY SCHOOL,7433 SOUTH DORCHESTER AV,7433 SOUTH DORCHESTER AV,7433 SOUTH DORCHESTER AV,CHICAGO,IL,60619,"7433 SOUTH DORCHESTER AVE, CHICAGO, IL 60619",4304,4304.0,,,1,1,1,1,1,1,1,1,1,1,1,1,1,1,1,1,ES,"7433-7435, South Dorchester Avenue, Essex, Woodlawn, Chicago, Cook County, Illinois, 60619, United States of America","41.7594694, -87.5899865573434",41.7594694,-87.5899865573434,POINT (450955.0425170978 4623239.127191084),0,0,158,0,0,0,0,0,0,0,0,0,0,0,0,0,0,0,0,,4022 S State St,"4022 S State St, Chicago, IL",Chicago,IL,Robert Taylor Homes,"South State Street, Park Manor, Greater Grand Crossing, Chicago, Cook County, Illinois, 60621, United States of America","41.7688938, -87.6249555",41.768893799999994,-87.6249555,3089.4010310181943
318,NCES,,,594.0,1.71E+11,0,0,0,0,0,0,0,0,0,TANNER ELEMENTARY SCHOOL,TANNER ELEMENTARY SCHOOL,TANNER ELEMENTARY SCHOOL,7350 SOUTH EVANS AV,7350 SOUTH EVANS AV,7350 SOUTH EVANS AV,CHICAGO,IL,60619,"7350 SOUTH EVANS AVE, CHICAGO, IL 60619",6909,6909.0,,,1,1,1,1,1,1,1,1,1,1,1,1,1,1,1,1,ES,"Tanner Elementary School, 7350, South Evans Avenue, Brookline, Greater Grand Crossing, Chicago, Cook County, Illinois, 60619, United States of America","41.7608606, -87.6070934",41.7608606,-87.6070934,POINT (449534.0528201009 4623403.479419331),0,0,158,0,0,0,0,0,0,0,0,0,0,0,0,0,0,0,0,,4022 S State St,"4022 S State St, Chicago, IL",Chicago,IL,Robert Taylor Homes,"South State Street, Park Manor, Greater Grand Crossing, Chicago, Cook County, Illinois, 60621, United States of America","41.7688938, -87.6249555",41.768893799999994,-87.6249555,1732.0700583069802
319,NCES,,,351.0,1.71E+11,0,0,0,0,0,0,0,0,0,KINZIE ELEMENTARY SCHOOL,KINZIE ELEMENTARY SCHOOL,KINZIE ELEMENTARY SCHOOL,5625 SOUTH MOBILE AV,5625 SOUTH MOBILE AV,5625 SOUTH MOBILE AV,CHICAGO,IL,60638,"5625 SOUTH MOBILE AVE, CHICAGO, IL 60638",5611,5611.0,,,1,1,1,1,1,1,1,1,1,1,1,1,1,1,1,1,ES,"Kinzie Elementary School, 5625, South Mobile Avenue, Garfield Ridge, Chicago, Cook County, Illinois, 60638, United States of America","41.7895478, -87.7788976",41.7895478,-87.7788976,POINT (435281.215971478 4626703.547968293),0,0,0,0,0,18,0,0,0,0,0,0,0,0,0,0,0,0,0,,246-250 W 38th St,"246-250 W 38th St, Chicago, IL",Chicago,IL,Wentworth Gardens,"West 38th Street, Corwith, Brighton Park, Chicago, Cook County, Illinois, 60632, United States of America","41.8243769, -87.7068962",41.8243769,-87.7068962,7122.481375961882
320,NCES,,,504.0,1.71E+11,0,0,0,0,0,0,0,0,0,PRUSSING ELEMENTARY SCHOOL,PRUSSING ELEMENTARY SCHOOL,PRUSSING ELEMENTARY SCHOOL,4650 NORTH MENARD AV,4650 NORTH MENARD AV,4650 NORTH MENARD AV,CHICAGO,IL,60630,"4650 NORTH MENARD AVE, CHICAGO, IL 60630",1504,1504.01,,,1,1,1,1,1,1,1,1,1,1,1,1,1,1,1,1,ES,"4650, North Menard Avenue, Portage Park, Chicago, Cook County, Illinois, 60630, United States of America","41.96561335, -87.77267403022279",41.96561335,-87.7726740302227,POINT (435974.3255869294 4646247.016695094),0,0,0,0,0,0,134,0,0,0,0,0,0,0,0,0,0,0,0,,714 W Division St,"714 W Division St, Chicago, IL",Chicago,IL,William Green Homes,"West Division Street, Moreland, Austin, Chicago, Cook County, Illinois, 60651, United States of America","41.9024164, -87.7424231",41.9024164,-87.7424231,7451.688917895329
321,NCES,,,588.0,1.71E+11,0,0,0,0,0,0,0,0,0,SUMNER ELEMENTARY MATH & SCI COMM ACADEMY,SUMNER ELEMENTARY MATH & SCI COMM ACADEMY,SUMNER ELEMENTARY MATH & SCI COMM ACADEMY,4320 WEST FIFTH AV,4320 WEST 5TH AV,4320 WEST 5TH AV,CHICAGO,IL,60624,"4320 WEST 5TH AVE, CHICAGO, IL 60624",2610,2610.0,,,1,1,1,1,1,1,1,1,1,1,1,1,1,1,1,1,ES,"4320, West 5th Avenue, West Garfield Park, Chicago, Cook County, Illinois, 60624, United States of America","41.87089059276535, -87.73330043396928",41.8708905927653,-87.7333004339692,POINT (439147.0109739578 4635701.440282612),0,0,0,75,0,0,0,0,0,0,0,0,0,0,0,0,0,0,0,,1224 W Roosevelt Rd,"1224 W Roosevelt Rd, Chicago, IL",Chicago,IL,Jane Addams Homes,"West Roosevelt Road, North Lawndale, Chicago, Cook County, Illinois, 60624, United States of America","41.8662079, -87.7225376",41.8662079,-87.7225376,1033.5243340556572
322,NCES,,,199.0,1.71E+11,0,0,0,0,0,0,0,0,0,FARADAY ELEMENTARY SCHOOL,FARADAY ELEMENTARY SCHOOL,FARADAY ELEMENTARY SCHOOL,3250 WEST MONROE ST,3250 WEST MONROE ST,3250 WEST MONROE ST,CHICAGO,IL,60624,"3250 WEST MONROE ST, CHICAGO, IL 60624",2713,2713.0,,,1,1,1,1,1,1,1,1,1,1,1,1,1,1,1,1,ES,"Faraday School, 3250-3258, West Monroe Street, East Garfield Park, Chicago, Cook County, Illinois, 60624, United States of America","41.88007435, -87.70818036924845",41.88007435,-87.70818036924841,POINT (441240.0264072925 4636703.585305451),0,0,0,0,0,0,138,0,0,0,0,0,0,0,0,0,0,0,0,,2517 W Adams St,"2517 W Adams St, Chicago, IL",Chicago,IL,Rockwell Gardens,"2517, West Adams Street, Claremont Cottages, Near West Side, Chicago, Cook County, Illinois, 60612, United States of America","41.87834518367347, -87.68911948979591",41.87834518,-87.68911949,1593.2341691010442
323,NCES,,,288.0,1.71E+11,0,0,0,0,0,0,0,0,0,HIRSCH METROPOLITAN HIGH SCHOOL,HIRSCH METROPOLITAN HIGH SCHOOL,HIRSCH METROPOLITAN HIGH SCHOOL,7740 SOUTH INGLESIDE AV,7740 SOUTH INGLESIDE AV,7740 SOUTH INGLESIDE AV,CHICAGO,IL,60619,"7740 SOUTH INGLESIDE AVE, CHICAGO, IL 60619",6915,6915.0,,,1,1,1,1,1,1,1,1,1,1,1,1,1,1,1,1,HS,"Hirsch Metropolitan High School, 7740, South Ingleside Avenue, Greater Grand Crossing, Chicago, Cook County, Illinois, 60619, United States of America","41.7539233, -87.6022702",41.7539233,-87.6022702,POINT (449929.6013496837 4622630.448390415),0,0,158,0,0,0,0,0,0,0,0,0,0,0,0,0,0,0,0,,4022 S State St,"4022 S State St, Chicago, IL",Chicago,IL,Robert Taylor Homes,"South State Street, Park Manor, Greater Grand Crossing, Chicago, Cook County, Illinois, 60621, United States of America","41.7688938, -87.6249555",41.768893799999994,-87.6249555,2513.756858544213
324,NCES,,,,1.71E+11,0,0,0,0,0,0,0,0,0,COOK COUNTY DEPT OF CORR HIGH SCHOOL,YORK ALTERNATIVE HIGH SCHOOL,YORK ALTERNATIVE HIGH SCHOOL,2700 SOUTH CALIFORNIA AV,2700 SOUTH CALIFORNIA AV,2700 SOUTH CALIFORNIA AV,CHICAGO,IL,60608,"2700 SOUTH CALIFORNIA AVE, CHICAGO, IL 60608",3013,8435.0,,,1,1,1,1,1,1,1,1,1,1,0,1,1,1,1,1,HS,"2700, South California Avenue, Bohemian California, South Lawndale, Chicago, Cook County, Illinois, 60608, United States of America","41.84151436249905, -87.69523042331576",41.841514362499,-87.69523042331569,POINT (442279.8623742382 4632413.597728676),0,0,0,0,0,18,0,0,0,0,0,0,0,0,0,0,0,0,0,,246-250 W 38th St,"246-250 W 38th St, Chicago, IL",Chicago,IL,Wentworth Gardens,"West 38th Street, Corwith, Brighton Park, Chicago, Cook County, Illinois, 60632, United States of America","41.8243769, -87.7068962",41.8243769,-87.7068962,2135.1648962132613
325,NCES,,,362.0,1.71E+11,0,0,0,0,0,0,0,0,0,LEE ELEMENTARY SCHOOL,LEE ELEMENTARY SCHOOL,LEE ELEMENTARY SCHOOL,6448 SOUTH TRIPP AV,6448 SOUTH TRIPP AV,6448 SOUTH TRIPP AV,CHICAGO,IL,60629,"6448 SOUTH TRIPP AVE, CHICAGO, IL 60629",6503,6503.01,,,1,1,1,1,1,1,1,1,1,1,1,1,1,1,1,1,ES,"6448, South Tripp Avenue, Archer Heights, Chicago, Cook County, Illinois, 60629, United States of America","41.7754489, -87.7291366320018",41.7754489,-87.7291366320018,POINT (439402.6190595102 4625101.945757614),0,0,0,0,0,2,0,0,0,0,0,0,0,0,0,0,0,0,0,,6238 S Hermitage Av,"6238 S Hermitage Av, Chicago, IL",Chicago,IL,Scattered Site Housing,"6238, South Hermitage Avenue, West Englewood, Chicago, Cook County, Illinois, 60636, United States of America","41.78068588307552, -87.66799468539163",41.78068588,-87.66799469,5114.557112809845
326,NCES,,,643.0,1.71E+11,0,0,0,0,0,0,0,0,0,WHISTLER ELEMENTARY SCHOOL,WHISTLER ELEMENTARY SCHOOL,WHISTLER ELEMENTARY SCHOOL,11533 SOUTH ADA ST,11533 SOUTH ADA ST,11533 SOUTH ADA ST,CHICAGO,IL,60643,"11533 SOUTH ADA ST, CHICAGO, IL 60643",5303,5303.0,,,1,1,1,1,1,1,1,1,1,1,1,1,1,1,1,1,ES,"11533, South Ada Street, Morgan Park, Chicago, Cook County, Illinois, 60643, United States of America","41.6840249, -87.65485572192983",41.6840249,-87.65485572192979,POINT (445498.7965071705 4614901.971004577),0,0,0,0,0,12,0,0,0,0,0,0,0,0,0,0,0,0,0,,3841 S Vincennes Av,"3841 S Vincennes Av, Chicago, IL",Chicago,IL,Ida B. Wells Homes,"South Vincennes Avenue, Park Manor, Greater Grand Crossing, Chicago, Cook County, Illinois, 60620, United States of America","41.7674384, -87.6270546",41.767438399999996,-87.6270546,9545.50065505958
327,NCES,,,,1.71E+11,0,0,0,0,0,0,0,0,0,CARVER AREA HIGH SCHOOL,CARVER MILITARY ACADEMY HIGH SCHOOL,CARVER MILITARY ACADEMY HIGH SCHOOL,13100 SOUTH DOTY WEST AV,13100 SOUTH DOTY AV,13100 SOUTH DOTY AV,CHICAGO,IL,60827,"13100 SOUTH DOTY AVE, CHICAGO, IL 60827",5401,5401.01,,,1,1,1,1,1,1,1,1,1,1,1,1,1,1,1,1,HS,"South Doty Avenue, South Deering, Chicago, Cook County, Illinois, 60633, United States of America","41.7015004, -87.5917399",41.7015004,-87.5917399,POINT (450765.0429248515 4616804.159932419),0,0,0,0,0,12,0,0,0,0,0,0,0,0,0,0,0,0,0,,3841 S Vincennes Av,"3841 S Vincennes Av, Chicago, IL",Chicago,IL,Ida B. Wells Homes,"South Vincennes Avenue, Park Manor, Greater Grand Crossing, Chicago, Cook County, Illinois, 60620, United States of America","41.7674384, -87.6270546",41.767438399999996,-87.6270546,7888.037454968078
328,NCES,,,249.0,1.71E+11,0,0,0,0,0,0,0,0,0,GREGORY ELEMENTARY SCHOOL,GREGORY MATH & SCI ELEMENTARY ACADEMY,GREGORY MATH & SCI ELEMENTARY ACADEMY,3715 WEST POLK ST,3715 WEST POLK ST,3715 WEST POLK ST,CHICAGO,IL,60624,"3715 WEST POLK ST, CHICAGO, IL 60624",2705,2705.0,,,1,1,1,1,1,1,1,1,1,1,1,1,1,1,1,1,ES,"3715, West Polk Street, East Garfield Park, Chicago, Cook County, Illinois, 60624, United States of America","41.87090543789149, -87.71863561763517",41.870905437891395,-87.7186356176351,POINT (440363.9927647349 4635692.796042727),0,0,0,75,0,0,0,0,0,0,0,0,0,0,0,0,0,0,0,,1224 W Roosevelt Rd,"1224 W Roosevelt Rd, Chicago, IL",Chicago,IL,Jane Addams Homes,"West Roosevelt Road, North Lawndale, Chicago, Cook County, Illinois, 60624, United States of America","41.8662079, -87.7225376",41.8662079,-87.7225376,613.9261896078368
