149,NCES,146.0,,181.0,1.71E+11,0,0,1,0,0,0,1,0,0,DELANO ELEMENTARY SCHOOL,DELANO ELEMENTARY SCHOOL,DELANO ELEMENTARY SCHOOL,3937 WEST WILCOX ST,3937 WEST WILCOX ST,3937 WEST WILCOX ST,CHICAGO,IL,60624,"3937 WEST WILCOX ST, CHICAGO, IL 60624",2608,2608.0,,2013.0,1,1,1,1,1,1,1,1,1,1,1,1,1,1,1,0,ES,"Delano Elementary School, 3937, West Wilcox Street, West Garfield Park, Chicago, Cook County, Illinois, 60624, United States of America","41.8783655, -87.7245002",41.8783655,-87.7245002,POINT (439884.3086937267 4636525.158475453),0,0,0,75,0,0,0,0,0,0,0,0,0,0,0,0,0,0,0,,1224 W Roosevelt Rd,"1224 W Roosevelt Rd, Chicago, IL",Chicago,IL,Jane Addams Homes,"West Roosevelt Road, North Lawndale, Chicago, Cook County, Illinois, 60624, United States of America","41.8662079, -87.7225376",41.8662079,-87.7225376,1359.6642232447516
150,NCES,165.0,,549.0,1.71E+11,0,0,1,0,0,0,1,0,0,SEXTON ELEMENTARY SCHOOL,SEXTON ELEMENTARY SCHOOL,SEXTON ELEMENTARY SCHOOL,6020 SOUTH LANGLEY AV,6020 SOUTH LANGLEY AV,6020 SOUTH LANGLEY AV,CHICAGO,IL,60637,"6020 SOUTH LANGLEY AVE, CHICAGO, IL 60637",4205,4205.0,,2013.0,1,1,1,1,1,1,1,1,1,1,1,1,1,1,1,0,ES,"6020, South Langley Avenue, Washington Park, Chicago, Cook County, Illinois, 60637, United States of America","41.785114050000004, -87.60910896710067",41.78511405,-87.6091089671006,POINT (449385.5748479125 4626097.407188321),0,0,0,0,0,12,0,0,0,0,0,0,0,0,0,0,0,0,0,,3740 S Cottage Grove Ave,"3740 S Cottage Grove Ave, Chicago, IL",Chicago,IL,Ida B. Wells Homes,"South Cottage Grove Avenue, Washington Park, Chicago, Cook County, Illinois, 60637, United States of America","41.7862906, -87.6060534",41.7862906,-87.60605340000001,285.5425648663433
151,NCES,124.0,,17.0,1.71E+11,0,0,1,0,0,0,1,0,0,OVERTON ELEMENTARY SCHOOL,OVERTON ELEMENTARY SCHOOL,OVERTON ELEMENTARY SCHOOL,221 EAST 49TH ST,221 EAST 49TH ST,221 EAST 49TH ST,CHICAGO,IL,60615,"221 EAST 49TH ST, CHICAGO, IL 60615",3818,3818.0,,2013.0,1,1,1,1,1,1,1,1,1,1,1,1,1,1,1,0,ES,"Overton Business and Technology Incubator, 221, East 49th Street, Forestville, Grand Boulevard, Chicago, Cook County, Illinois, 60615, United States of America","41.80526245, -87.62027035398313",41.80526245,-87.6202703539831,POINT (448474.2464664218 4628341.026265929),323,0,0,0,0,0,0,0,0,0,0,0,0,0,0,0,0,0,0,,4845 S Federal St,"4845 S Federal St, Chicago, IL",Chicago,IL,Robert Taylor Homes,"4845, South Federal Street, Washington Park, Chicago, Cook County, Illinois, 60609, United States of America","41.80881049411765, -87.628466",41.80881049,-87.628466,786.5691601494073
152,NCES,175.0,,637.0,1.71E+11,0,0,0,0,0,1,0,0,0,WENTWORTH ELEMENTARY SCHOOL,WENTWORTH ELEMENTARY SCHOOL,WENTWORTH ELEMENTARY SCHOOL,6950 SOUTH SANGAMON ST,1340 WEST 71ST ST,1340 WEST 71ST ST,CHICAGO,IL,60636,"1340 WEST 71ST ST, CHICAGO, IL 60636",6717,8349.0,,2013.0,1,1,1,1,1,1,1,1,1,1,1,1,1,1,1,0,ES,"1340, West 71st Street, West Englewood, Chicago, Cook County, Illinois, 60636, United States of America","41.7653026, -87.6583667759381",41.7653026,-87.65836677593809,POINT (445275.5968511371 4623928.003078028),0,0,0,0,0,2,0,0,0,0,0,0,0,0,0,0,0,0,0,,6238 S Hermitage Av,"6238 S Hermitage Av, Chicago, IL",Chicago,IL,Scattered Site Housing,"6238, South Hermitage Avenue, West Englewood, Chicago, Cook County, Illinois, 60636, United States of America","41.78068588307552, -87.66799468539163",41.78068588,-87.66799469,1886.149325471035
153,NCES,113.0,,327.0,1.71E+11,0,0,1,0,0,0,1,0,0,ALTGELD ELEMENTARY SCHOOL,ALTGELD ELEMENTARY SCHOOL,ALTGELD ELEMENTARY SCHOOL,1340 WEST 71ST ST,1340 WEST 71ST ST,1340 WEST 71ST ST,CHICAGO,IL,60636,"1340 WEST 71ST ST, CHICAGO, IL 60636",6717,8349.0,,2013.0,1,1,1,1,1,1,1,1,1,1,1,1,1,1,1,0,ES,"1340, West 71st Street, West Englewood, Chicago, Cook County, Illinois, 60636, United States of America","41.7653026, -87.6583667759381",41.7653026,-87.65836677593809,POINT (445275.5968511371 4623928.003078028),0,0,0,0,0,2,0,0,0,0,0,0,0,0,0,0,0,0,0,,6238 S Hermitage Av,"6238 S Hermitage Av, Chicago, IL",Chicago,IL,Scattered Site Housing,"6238, South Hermitage Avenue, West Englewood, Chicago, Cook County, Illinois, 60636, United States of America","41.78068588307552, -87.66799468539163",41.78068588,-87.66799469,1886.149325471035
154,NCES,107.0,,10.0,1.71E+11,0,0,1,0,0,0,1,0,0,KOHN ELEMENTARY SCHOOL,KOHN ELEMENTARY SCHOOL,KOHN ELEMENTARY SCHOOL,10414 SOUTH STATE ST,10414 SOUTH STATE ST,10414 SOUTH STATE ST,CHICAGO,IL,60628,"10414 SOUTH STATE ST, CHICAGO, IL 60628",4910,4910.0,,2013.0,1,1,1,1,1,1,1,1,1,1,1,1,1,1,1,0,ES,"10414, South State Street, Roseland, Chicago, Cook County, Illinois, 60628, United States of America","41.70506185, -87.62386448292011",41.70506185,-87.6238644829201,POINT (448095.0106606758 4617218.429418221),0,0,0,0,0,12,0,0,0,0,0,0,0,0,0,0,0,0,0,,3841 S Vincennes Av,"3841 S Vincennes Av, Chicago, IL",Chicago,IL,Ida B. Wells Homes,"South Vincennes Avenue, Park Manor, Greater Grand Crossing, Chicago, Cook County, Illinois, 60620, United States of America","41.7674384, -87.6270546",41.767438399999996,-87.6270546,6930.587801947397
155,NCES,147.0,,625.0,1.71E+11,0,0,0,0,0,1,0,0,0,LAURA WARD ELEMENTARY SCHOOL,WARD L ELEMENTARY SCHOOL,WARD  L ELEMENTARY SCHOOL,410 NORTH MONTICELLO AV,646 NORTH LAWNDALE AV,646 NORTH LAWNDALE AV,CHICAGO,IL,60624,"646 NORTH LAWNDALE AVE, CHICAGO, IL 60624",2315,2315.0,,2013.0,1,1,1,1,1,1,1,1,1,1,1,1,1,1,1,0,ES,"646, North Lawndale Avenue, Pacific Junction, Humboldt Park, Chicago, Cook County, Illinois, 60624, United States of America","41.89263287029227, -87.71878015892739",41.8926328702922,-87.71878015892729,POINT (440372.2024696739 4638105.239556566),0,0,0,0,0,0,134,0,0,0,0,0,0,0,0,0,0,0,0,,714 W Division St,"714 W Division St, Chicago, IL",Chicago,IL,William Green Homes,"West Division Street, Moreland, Austin, Chicago, Cook County, Illinois, 60651, United States of America","41.9024164, -87.7424231",41.9024164,-87.7424231,2242.0143917065425
156,NCES,174.0,,461.0,1.71E+11,0,0,0,1,0,0,1,0,0,OKEEFFE ELEMENTARY SCHOOL,OKEEFFE ELEMENTARY SCHOOL,OKEEFFE ELEMENTARY SCHOOL,6940 SOUTH MERRILL AV,6940 SOUTH MERRILL AV,6940 SOUTH MERRILL AV,CHICAGO,IL,60649,"6940 SOUTH MERRILL AVE, CHICAGO, IL 60649",4301,4301.01,,2013.0,1,1,1,1,1,1,1,1,1,1,1,1,1,1,1,0,ES,"6940, South Merrill Avenue, O'Keeffe, South Shore, Chicago, Cook County, Illinois, 60649, United States of America","41.7686369, -87.573061962371",41.7686369,-87.57306196237103,POINT (452368.7524440649 4624247.437447316),0,0,0,0,0,12,0,0,0,0,0,0,0,0,0,0,0,0,0,,3740 S Cottage Grove Ave,"3740 S Cottage Grove Ave, Chicago, IL",Chicago,IL,Ida B. Wells Homes,"South Cottage Grove Avenue, Washington Park, Chicago, Cook County, Illinois, 60637, United States of America","41.7862906, -87.6060534",41.7862906,-87.60605340000001,3370.394284487671
157,NCES,169.0,,243.0,1.71E+11,0,0,1,0,0,0,1,0,0,GRANVILLE T WOODS MATH/SCIENCE AC,WOODS ELEMENTARY MATH & SCIENCE ACADEMY,WOODS ELEMENTARY MATH & SCIENCE ACADEMY,6206 SOUTH RACINE AV,6206 SOUTH RACINE AV,6206 SOUTH RACINE AV,CHICAGO,IL,60636,"6206 SOUTH RACINE AVE, CHICAGO, IL 60636",6709,6709.0,,2013.0,1,1,1,1,1,1,1,1,1,1,1,1,1,1,1,0,ES,"6206, South Racine Avenue, Englewood, Chicago, Cook County, Illinois, 60620, United States of America","41.7808715, -87.65491331321428",41.7808715,-87.65491331321421,POINT (445575.8180746319 4625654.353194583),0,0,0,0,0,2,0,0,0,0,0,0,0,0,0,0,0,0,0,,6238 S Hermitage Av,"6238 S Hermitage Av, Chicago, IL",Chicago,IL,Scattered Site Housing,"6238, South Hermitage Avenue, West Englewood, Chicago, Cook County, Illinois, 60636, United States of America","41.78068588307552, -87.66799468539163",41.78068588,-87.66799469,1087.3147303383346
158,NCES,108.0,,569.0,1.71E+11,0,0,1,0,0,0,1,0,0,SONGHAI ELEMENTARY LEARNING INSTITUTE,SONGHAI ELEMENTARY LEARNING INSTITUTE,SONGHAI ELEMENTARY LEARNING INSTITUTE,11725 SOUTH PERRY AV,11725 SOUTH PERRY AV,11725 SOUTH PERRY AV,CHICAGO,IL,60628,"11725 SOUTH PERRY AVE, CHICAGO, IL 60628",5302,5302.0,,2013.0,1,1,1,1,1,1,1,1,1,1,1,1,1,1,1,0,ES,"Songhai Learning Institute, 11725, South Perry Avenue, Gano, West Pullman, Chicago, Cook County, Illinois, 60628, United States of America","41.6807549, -87.6248568",41.6807549,-87.6248568,POINT (447992.8739435684 4614520.381160975),0,0,0,0,0,12,0,0,0,0,0,0,0,0,0,0,0,0,0,,3841 S Vincennes Av,"3841 S Vincennes Av, Chicago, IL",Chicago,IL,Ida B. Wells Homes,"South Vincennes Avenue, Park Manor, Greater Grand Crossing, Chicago, Cook County, Illinois, 60620, United States of America","41.7674384, -87.6270546",41.767438399999996,-87.6270546,9625.962864689267
159,NCES,,,118.0,1.71E+11,0,0,0,1,0,0,1,0,0,BARTON ELEMENTARY SCHOOL,BARTON ELEMENTARY SCHOOL,BARTON ELEMENTARY SCHOOL,7650 SOUTH WOLCOTT AV,7650 SOUTH WOLCOTT AV,7650 SOUTH WOLCOTT AV,CHICAGO,IL,60620,"7650 SOUTH WOLCOTT AVE, CHICAGO, IL 60620",7104,7104.0,,2013.0,1,1,1,1,1,1,1,1,1,1,1,1,1,1,1,0,ES,"7650, South Wolcott Avenue, South Englewood, Auburn Gresham, Chicago, Cook County, Illinois, 60620, United States of America","41.754798448352794, -87.67094357275694",41.7547984483527,-87.6709435727569,POINT (444221.0938482582 4622769.856902251),0,0,0,0,0,2,0,0,0,0,0,0,0,0,0,0,0,0,0,,6238 S Hermitage Av,"6238 S Hermitage Av, Chicago, IL",Chicago,IL,Scattered Site Housing,"6238, South Hermitage Avenue, West Englewood, Chicago, Cook County, Illinois, 60636, United States of America","41.78068588307552, -87.66799468539163",41.78068588,-87.66799469,2884.677510860536
160,NCES,116.0,,366.0,1.71E+11,0,0,0,1,0,0,1,0,0,LEWIS ELEMENTARY SCHOOL,LEWIS ELEMENTARY SCHOOL,LEWIS ELEMENTARY SCHOOL,1431 NORTH LEAMINGTON AV,1431 NORTH LEAMINGTON AV,1431 NORTH LEAMINGTON AV,CHICAGO,IL,60651,"1431 NORTH LEAMINGTON AVE, CHICAGO, IL 60651",2508,2508.0,,2013.0,1,1,1,1,1,1,1,1,1,1,1,1,1,1,1,0,ES,"Lewis Elementary School, 1431-1457, North Leamington Avenue, Beat 2523, Austin, Chicago, Cook County, Illinois, 60651, United States of America","41.9069762, -87.7542243",41.9069762,-87.7542243,POINT (437445.8476964408 4639722.989810608),0,0,0,0,0,0,134,0,0,0,0,0,0,0,0,0,0,0,0,,714 W Division St,"714 W Division St, Chicago, IL",Chicago,IL,William Green Homes,"West Division Street, Moreland, Austin, Chicago, Cook County, Illinois, 60651, United States of America","41.9024164, -87.7424231",41.9024164,-87.7424231,1102.0313795290701
161,NCES,131.0,,9.0,1.71E+11,0,0,1,0,0,0,1,1,0,VON HUMBOLDT ELEMENTARY SCHOOL,VON HUMBOLDT ELEMENTARY SCHOOL,VON HUMBOLDT ELEMENTARY SCHOOL,2620 WEST HIRSCH ST,2620 WEST HIRSCH ST,2620 WEST HIRSCH ST,CHICAGO,IL,60622,"2620 WEST HIRSCH ST, CHICAGO, IL 60622",2410,2410.0,,2013.0,1,1,1,1,1,1,1,1,1,1,1,1,1,1,1,0,ES,"2620, West Hirsch Street, West Town, Chicago, Cook County, Illinois, 60622, United States of America","41.9069063, -87.6925635",41.9069063,-87.6925635,POINT (442559.8613325867 4639672.099977055),279,0,0,0,0,0,0,0,0,0,0,0,0,0,0,0,0,0,0,,2215 W Lake St,"2215 W Lake St, Chicago, IL",Chicago,IL,Governor Henry Horner Homes,"2215, West Lake Street, Near West Side, Chicago, Cook County, Illinois, 60612, United States of America","41.884830336734694, -87.68308909183673",41.88483034,-87.68308909,2574.049162839565
162,NCES,,,,1.71E+11,0,0,0,0,0,0,0,0,1,DUGAN HIGH SCHOOL,PEACE AND EDUCATION COALITION HIGH SCHOOL,PEACE AND EDUCATION COALITION HIGH SCHOOL,4541 SOUTH WOOD,4946 SOUTH PAULINA ST,4946 SOUTH PAULINA ST,CHICAGO,IL,60609,"4946 SOUTH PAULINA ST, CHICAGO, IL 60609",6113,6113.0,1998.0,,1,1,1,1,1,1,1,1,1,1,0,1,1,1,1,1,HS,"The Peace and Education Coalition Alternative High School, 4946, South Paulina Street, Back of the Yards, New City, Chicago, Cook County, Illinois, 60609, United States of America","41.80356475, -87.66764341880257",41.80356475,-87.66764341880251,POINT (444537.4903533361 4628182.022187319),0,0,0,0,0,2,0,0,0,0,0,0,0,0,0,0,0,0,0,,6238 S Hermitage Av,"6238 S Hermitage Av, Chicago, IL",Chicago,IL,Scattered Site Housing,"6238, South Hermitage Avenue, West Englewood, Chicago, Cook County, Illinois, 60636, United States of America","41.78068588307552, -87.66799468539163",41.78068588,-87.66799469,2540.3863933156317
163,NCES,,,11.0,1.71E+11,0,0,0,0,0,0,0,0,1,AMES MIDDLE SCHOOL,AMES MIDDLE SCHOOL,AMES MIDDLE SCHOOL,1920 NORTH HAMLIN,1920 NORTH HAMLIN AV,1920 NORTH HAMLIN AV,CHICAGO,IL,60647,"1920 NORTH HAMLIN AVE, CHICAGO, IL 60647",2229,2229.0,1998.0,,1,1,1,1,1,1,1,1,1,1,1,1,1,1,1,1,MS,"1920, North Hamlin Avenue, Beat 2535, Chicago, Cook County, Illinois, 60647, United States of America","41.91619355, -87.7227637658194",41.91619355,-87.7227637658194,POINT (440063.773259747 4640723.910095361),0,0,0,0,0,0,134,0,0,0,0,0,0,0,0,0,0,0,0,,714 W Division St,"714 W Division St, Chicago, IL",Chicago,IL,William Green Homes,"West Division Street, Moreland, Austin, Chicago, Cook County, Illinois, 60651, United States of America","41.9024164, -87.7424231",41.9024164,-87.7424231,2235.7566739724625
164,NCES,,,197.0,1.71E+11,0,0,0,0,0,0,0,0,1,MARQUETTE EAST,FAIRFIELD ELEMENTARY ACADEMY,FAIRFIELD ELEMENTARY ACADEMY,6201 SOUTH FAIRFIELD,6201 SOUTH FAIRFIELD AV,6201 SOUTH FAIRFIELD AV,CHICAGO,IL,60629,"6201 SOUTH FAIRFIELD AVE, CHICAGO, IL 60629",6602,8350.0,1998.0,,1,1,1,1,1,1,1,1,1,1,1,1,1,1,1,1,ES,"6201-6205, South Fairfield Avenue, Chicago Lawn, Chicago, Cook County, Illinois, 60629, United States of America","41.78064875, -87.69175290219181",41.78064875,-87.69175290219181,POINT (442514.1829309699 4625653.59467339),0,0,0,0,0,2,0,0,0,0,0,0,0,0,0,0,0,0,0,,6238 S Hermitage Av,"6238 S Hermitage Av, Chicago, IL",Chicago,IL,Scattered Site Housing,"6238, South Hermitage Avenue, West Englewood, Chicago, Cook County, Illinois, 60636, United States of America","41.78068588307552, -87.66799468539163",41.78068588,-87.66799469,1974.4228009844383
165,NCES,,,114.0,1.71E+11,0,0,0,0,0,0,0,0,1,CHICAGO MILITARY ACADEMY,CHICAGO MILITARY ACADEMY HIGH SCHOOL,CHICAGO MILITARY ACADEMY HIGH SCHOOL,3519 SOUTH GILES AV,3519 SOUTH GILES AV,3519 SOUTH GILES AV,CHICAGO,IL,60653,"3519 SOUTH GILES AVE, CHICAGO, IL 60653",3513,8396.0,1999.0,,0,1,1,1,1,1,1,1,1,1,1,1,1,1,1,1,HS,"3519, South Giles Avenue, Douglas, Chicago, Cook County, Illinois, 60653, United States of America","41.83065347182323, -87.61921793811833",41.830653471823204,-87.61921793811831,POINT (448581.9858451334 4631159.460844134),0,0,0,0,0,0,34,0,0,0,0,0,0,0,0,0,0,0,0,,504-510 E 38th St,"504-510 E 38th St, Chicago, IL",Chicago,IL,Ida B. Wells Homes,"504, East 38th Street, Oakland, Chicago, Cook County, Illinois, 60653, United States of America","41.82578584289766, -87.61415773848951",41.82578584,-87.61415774,684.5898987776569
166,NCES,,,453.0,1.71E+11,1,0,0,0,0,0,0,0,1,NORTHSIDE COLLEGE PREP,NORTHSIDE COLLEGE PREPARATORY HIGH SCHOOL,NORTHSIDE COLLEGE PREPARATORY HIGH SCHOOL,5501 NORTH KEDZIE AV,5501 NORTH KEDZIE AV,5501 NORTH KEDZIE AV,CHICAGO,IL,60625,"5501 NORTH KEDZIE AVE, CHICAGO, IL 60625",1304,8318.0,1999.0,,0,1,1,1,1,1,1,1,1,1,1,1,1,1,1,1,HS,"5501, North Kedzie Avenue, North Park, Chicago, Cook County, Illinois, 60625, United States of America","41.981308150000004, -87.70774228174773",41.98130815,-87.7077422817477,POINT (441369.1575717479 4647943.115547215),0,0,0,0,0,0,134,0,0,0,0,0,0,0,0,0,0,0,0,,714 W Division St,"714 W Division St, Chicago, IL",Chicago,IL,William Green Homes,"West Division Street, Moreland, Austin, Chicago, Cook County, Illinois, 60651, United States of America","41.9024164, -87.7424231",41.9024164,-87.7424231,9219.27838266016
167,NCES,,,455.0,1.71E+11,0,0,0,0,0,0,0,0,1,NORTHWEST MIDDLE SCHOOL,NORTHWEST MIDDLE SCHOOL,NORTHWEST MIDDLE SCHOOL,5252 WEST PALMER ST,5252 WEST PALMER ST,5252 WEST PALMER ST,CHICAGO,IL,60639,"5252 WEST PALMER ST, CHICAGO, IL 60639",1912,1912.0,1999.0,,0,1,1,1,1,1,1,1,1,1,1,1,1,1,1,1,MS,"5246-5252, West Palmer Street, Beat 2522, Belmont Cragin, Chicago, Cook County, Illinois, 60639, United States of America","41.92120115, -87.75810585815147",41.92120115,-87.7581058581514,POINT (437137.8760220788 4641305.199124468),0,0,0,0,0,0,134,0,0,0,0,0,0,0,0,0,0,0,0,,714 W Division St,"714 W Division St, Chicago, IL",Chicago,IL,William Green Homes,"West Division Street, Moreland, Austin, Chicago, Cook County, Illinois, 60651, United States of America","41.9024164, -87.7424231",41.9024164,-87.7424231,2458.0350646835036
168,NCES,,,536.0,1.71E+11,0,0,0,0,0,0,0,0,1,SANDOVAL ELEMENTARY SCHOOL,SANDOVAL ELEMENTARY SCHOOL,SANDOVAL ELEMENTARY SCHOOL,5534 SOUTH ST LOUIS AV,5534 SOUTH SAINT LOUIS AV,5534 SOUTH SAINT LOUIS AV,CHICAGO,IL,60629,"5534 SOUTH SAINT LOUIS AVE, CHICAGO, IL 60629",6309,6309.0,1999.0,,0,1,1,1,1,1,1,1,1,1,1,1,1,1,1,1,ES,"Sorroro Sandoval Elementary School, 5534, South Saint Louis Avenue, Garfield Manor, Gage Park, Chicago, Cook County, Illinois, 60629, United States of America","41.792728749999995, -87.71191965367433",41.7927287499999,-87.7119196536743,POINT (440849.3879070092 4627008.463599997),0,0,0,0,0,18,0,0,0,0,0,0,0,0,0,0,0,0,0,,246-250 W 38th St,"246-250 W 38th St, Chicago, IL",Chicago,IL,Wentworth Gardens,"West 38th Street, Corwith, Brighton Park, Chicago, Cook County, Illinois, 60632, United States of America","41.8243769, -87.7068962",41.8243769,-87.7068962,3538.5815945500003
169,NCES,,,127.0,1.71E+11,0,0,0,0,0,0,0,0,1,JOHNNIE COLEMON ELEMENTARY SCHOOL,COLEMON J ELEMENTARY ACADEMY,COLEMON J ELEMENTARY ACADEMY,1441 WEST 119TH ST,1441 WEST 119TH ST,1441 WEST 119TH ST,CHICAGO,IL,60643,"1441 WEST 119TH ST, CHICAGO, IL 60643",5304,5304.0,2000.0,,0,0,0,1,1,1,1,1,1,1,1,1,1,1,1,1,ES,"Johnnie Colemon Academy, 1441, West 119th Street, Placerdale, West Pullman, Chicago, Cook County, Illinois, 60643, United States of America","41.676993100000004, -87.65782672473637",41.6769931,-87.6578267247363,POINT (445245.5690519561 4614123.159601308),0,0,0,0,0,12,0,0,0,0,0,0,0,0,0,0,0,0,0,,3841 S Vincennes Av,"3841 S Vincennes Av, Chicago, IL",Chicago,IL,Ida B. Wells Homes,"South Vincennes Avenue, Park Manor, Greater Grand Crossing, Chicago, Cook County, Illinois, 60620, United States of America","41.7674384, -87.6270546",41.767438399999996,-87.6270546,10362.985508466032
170,NCES,,,,1.71E+11,0,0,0,0,0,0,0,0,1,PAYTON COLLEGE PREPARATORY H S,PAYTON COLLEGE PREPARATORY HIGH SCHOOL,PAYTON COLLEGE PREPARATORY HIGH SCHOOL,1034 NORTH WELLS ST,1034 NORTH WELLS ST,1034 NORTH WELLS ST,CHICAGO,IL,60610,"1034 NORTH WELLS ST, CHICAGO, IL 60610",809,8383.0,2000.0,,0,0,1,1,1,1,1,1,1,1,1,1,1,1,1,1,HS,"Walter Payton College Prep, 1034, North Wells Street, Chicago River North, Near North Side, Chicago, Cook County, Illinois, 60610, United States of America","41.90124575, -87.63555161844084",41.90124575,-87.6355516184408,POINT (447283.7040219705 4639007.015914179),0,0,65,0,0,0,0,0,0,0,0,0,0,0,0,0,0,0,0,,1158 N Cleveland Av,"1158 N Cleveland Av, Chicago, IL",Chicago,IL,Frances Cabrini Homes,"1158, North Cleveland Avenue, Parkside of Old Town, Near North Side, Chicago, Cook County, Illinois, 60610, United States of America","41.90306093103448, -87.64129837931034",41.90306093,-87.64129838,517.5332114482204
171,NCES,,,262.0,1.71E+11,0,0,0,0,0,0,0,0,1,NEW DAWES AREA ELEMENTARY SCHOOL,HAMPTON ELEMENTARY FINE & PERF ARTS SCHOOL,HAMPTON ELEMENTARY FINE & PERF ARTS SCHOOL,3434 WEST 77TH ST,3434 WEST 77TH ST,3434 WEST 77TH ST,CHICAGO,IL,60652,"3434 WEST 77TH ST, CHICAGO, IL 60652",7001,7001.0,2000.0,,0,0,1,1,1,1,1,1,1,1,1,1,1,1,1,1,ES,"Lionel Hampton Elementary School, 3434, West 77th Street, Ashburn, Chicago, Cook County, Illinois, 60652, United States of America","41.7537531, -87.70896390197873",41.7537531,-87.7089639019787,POINT (441059.2986187751 4622679.145905016),0,0,0,0,0,2,0,0,0,0,0,0,0,0,0,0,0,0,0,,6238 S Hermitage Av,"6238 S Hermitage Av, Chicago, IL",Chicago,IL,Scattered Site Housing,"6238, South Hermitage Avenue, West Englewood, Chicago, Cook County, Illinois, 60636, United States of America","41.78068588307552, -87.66799468539163",41.78068588,-87.66799469,4532.003471765636
172,NCES,,,,1.71E+11,0,0,0,0,0,0,0,0,0,RUDOLPH ELEMENTARY LEARNING CENTER,RUDOLPH ELEMENTARY LEARNING CENTER,RUDOLPH ELEMENTARY LEARNING CENTER,110 NORTH PAULINA ST,110 NORTH PAULINA ST,110 NORTH PAULINA ST,CHICAGO,IL,60612,"110 NORTH PAULINA ST, CHICAGO, IL 60612",2804,2804.0,,,1,1,1,1,1,1,1,1,1,1,1,1,1,1,1,1,ES,"100-110, North Paulina Street, Hermitage Manor Cooperative, Near West Side, Chicago, Cook County, Illinois, 60622, United States of America","41.8836568, -87.66966704257857",41.8836568,-87.66966704257851,POINT (444438.7196771689 4637075.683504807),117,0,0,0,0,0,0,0,0,0,0,0,0,0,0,0,0,0,0,,120 N Hermitage Av,"120 N Hermitage Av, Chicago, IL",Chicago,IL,Governor Henry Horner Homes,"120, North Hermitage Avenue, Near West Side, Chicago, Cook County, Illinois, 60612, United States of America","41.88373412570285, -87.67070334795231",41.88373413,-87.67070335,86.41151174094776
173,NCES,,,,1.71E+11,0,0,0,0,0,0,0,0,0,STOCK ELEMENTARY SCHOOL,STOCK EARLY CHILDHOOD CENTER,STOCK EARLY CHILDHOOD CENTER,7507 WEST BIRCHWOOD AV,7507 WEST BIRCHWOOD AV,7507 WEST BIRCHWOOD AV,CHICAGO,IL,60631,"7507 WEST BIRCHWOOD AVE, CHICAGO, IL 60631",901,901.0,,,1,1,1,1,1,1,1,1,1,1,1,1,1,1,1,1,ES,"7507, West Birchwood Avenue, Edison Park, Chicago, Cook County, Illinois, 60631, United States of America","42.01646435, -87.81429038135425",42.01646435,-87.8142903813542,POINT (432579.5537756491 4651924.933643727),0,0,0,0,0,144,0,0,0,0,0,0,0,0,0,0,0,0,0,,630 W Evergreen Av,"630 W Evergreen Av, Chicago, IL",Chicago,IL,William Green Homes,"630, West Evergreen Avenue, Forest River, Cook County, Illinois, 60056, United States of America","42.06274091335322, -87.94560975310594",42.06274091,-87.94560975,12022.881721059604
174,NCES,,,654.0,1.71E+11,0,0,0,0,0,0,0,0,0,WOODLAWN ELEMENTARY COMMUNITY SCHOOL,WOODLAWN ELEMENTARY COMMUNITY SCHOOL,WOODLAWN ELEMENTARY COMMUNITY SCHOOL,6434 SOUTH UNIVERSITY AV,6657 SOUTH KIMBARK AV,6657 SOUTH KIMBARK AV,CHICAGO,IL,60637,"6657 SOUTH KIMBARK AVE, CHICAGO, IL 60637",4210,8344.0,,,1,1,1,1,1,1,1,1,1,1,1,1,1,1,1,1,ES,"6657, South Kimbark Avenue, Woodlawn, Chicago, Cook County, Illinois, 60637, United States of America","41.77377165, -87.59416360499378",41.77377165,-87.59416360499371,POINT (450618.7764293208 4624829.424506069),0,0,0,0,0,12,0,0,0,0,0,0,0,0,0,0,0,0,0,,3740 S Cottage Grove Ave,"3740 S Cottage Grove Ave, Chicago, IL",Chicago,IL,Ida B. Wells Homes,"South Cottage Grove Avenue, Washington Park, Chicago, Cook County, Illinois, 60637, United States of America","41.7862906, -87.6060534",41.7862906,-87.60605340000001,1705.3769886803752
175,NCES,,,,1.71E+11,0,0,0,0,0,0,0,0,0,SIMPSON ALTER SCHOOL FOR PREG GIRLS,SIMPSON ACADEMY HIGH SCHOOL FOR YOUNG WOMEN,SIMPSON ACADEMY HIGH SCHOOL FOR YOUNG WOMEN,1321 SOUTH PAULINA ST,1321 SOUTH PAULINA ST,1321 SOUTH PAULINA ST,CHICAGO,IL,60608,"1321 SOUTH PAULINA ST, CHICAGO, IL 60608",2840,8429.0,,,1,1,1,1,1,1,1,1,1,1,0,1,1,1,1,1,HS,"Simpson Academy for Young Women, 1321, South Paulina Street, Near West Side, Illinois Medical District, Cook County, Illinois, 60608, United States of America","41.8644772, -87.668109",41.8644772,-87.668109,POINT (444551.4134817191 4634945.217731762),0,0,0,0,0,0,150,0,0,0,0,0,0,0,0,0,0,0,0,,1510 W 13th St,"1510 W 13th St, Chicago, IL",Chicago,IL,Grace Abbott Homes,"1510, West 13th Street, Claremont Cottages, Near West Side, Illinois Medical District, Cook County, Illinois, 60608, United States of America","41.8651656286181, -87.66614856909499",41.86516563,-87.66614857,179.76729934686819
176,NCES,,,,1.71E+11,0,0,0,0,0,0,0,0,0,BEARD ELEMENTARY SCHOOL,BEARD ELEMENTARY SCHOOL,BEARD ELEMENTARY SCHOOL,6445 WEST STRONG ST,6445 WEST STRONG ST,6445 WEST STRONG ST,CHICAGO,IL,60656,"6445 WEST STRONG ST, CHICAGO, IL 60656",1007,1007.0,,,1,1,1,1,1,1,1,1,1,1,1,1,1,1,1,1,ES,"6445, West Strong Street, Colonial Gardens, Chicago, Cook County, Illinois, 60656, United States of America","41.97029002518247, -87.78955411539086",41.9702900251824,-87.7895541153908,POINT (434580.3759238604 4646779.016900452),0,0,0,0,0,0,134,0,0,0,0,0,0,0,0,0,0,0,0,,714 W Division St,"714 W Division St, Chicago, IL",Chicago,IL,William Green Homes,"West Division Street, Moreland, Austin, Chicago, Cook County, Illinois, 60651, United States of America","41.9024164, -87.7424231",41.9024164,-87.7424231,8488.938878744473
177,NCES,,,19.0,1.71E+11,0,0,0,0,0,0,0,0,0,ARIEL ELEMENTARY COMMUNITY SCHOOL,ARIEL ELEMENTARY COMMUNITY ACADEMY,ARIEL ELEMENTARY COMMUNITY ACADEMY,4434 SOUTH LAKE PARK AV,1119 EAST 46TH ST,1119 EAST 46TH ST,CHICAGO,IL,60653,"1119 EAST 46TH ST, CHICAGO, IL 60653",3902,3902.0,,,1,1,1,1,1,1,1,1,1,1,1,1,1,1,1,1,ES,"1119-1125, East 46th Street, Kenwood, Chicago, Cook County, Illinois, 60653, United States of America","41.81100035, -87.59794843183408",41.81100035,-87.597948431834,POINT (450332.964789915 4628964.940194316),0,158,0,0,0,0,0,0,0,0,0,0,0,0,0,0,0,0,0,,4445 S Evans Av,"4445 S Evans Av, Chicago, IL",Chicago,IL,Washington Park,"4445, South Evans Avenue, Forestville, Grand Boulevard, Chicago, Cook County, Illinois, 60653, United States of America","41.81413920570469, -87.60818968596692",41.81413921,-87.60818969,919.2874767721942
178,NCES,,,,1.71E+11,0,0,0,0,0,0,0,0,0,MONTEFIORE SPECIAL ELEMENTARY SCHOOL,MONTEFIORE SPECIAL ELEMENTARY SCHOOL,MONTEFIORE SPECIAL ELEMENTARY SCHOOL,1310 SOUTH ASHLAND AV,1310 SOUTH ASHLAND AV,1310 SOUTH ASHLAND AV,CHICAGO,IL,60608,"1310 SOUTH ASHLAND AVE, CHICAGO, IL 60608",2840,8429.0,,,1,1,1,1,1,1,1,1,1,1,0,1,1,1,1,1,ES,"Former Moses Montefiore Academy, 1310, South Ashland Avenue, Near West Side, Chicago, Cook County, Illinois, 60608, United States of America","41.86449145, -87.66673508459937",41.86449145,-87.66673508459931,POINT (444665.4521480462 4634945.913384572),0,0,0,0,0,0,150,0,0,0,0,0,0,0,0,0,0,0,0,,1510 W 13th St,"1510 W 13th St, Chicago, IL",Chicago,IL,Grace Abbott Homes,"1510, West 13th Street, Claremont Cottages, Near West Side, Illinois Medical District, Cook County, Illinois, 60608, United States of America","41.8651656286181, -87.66614856909499",41.86516563,-87.66614857,89.29033943602387
