,source,wbez_ids,wbez_idn,gci_id,ncessch,selectiveenrollment,charter,closed,turn,other,build_close,C_T,multaction,newschool,schnam_first,schnam_last,schnam_action,address_first,address_last,address_action,city,state,lzip_action,address_full,tract2000_nces,tract2010_nces,newschool_yr,action_yr,open98,open99,open00,open01,open02,open03,open04,open05,open06,open07,open08,open09,open10,open11,open12,open13,type_all,location,point,latitude,longitude,geometry,actual00,actual01,actual02,actual03,actual04,actual05,actual06,actual07,actual08,actual09,actual10,actual11,actual12,actual13,actual14,actual15,actual16,actual17,actual18,actualtotal,address_final,address_full,city,state,dvm_edit,location,point,latitude,longitude,dist
0,NCES,,,,1.71E+11,0,0,1,0,0,0,1,0,0,HIGH SCHOOL TRANSITION CENTER H,DORSEY ACADEMY PREPARATION CENTER,DORSEY ACADEMY PREPARATION CENTER,9035 SOUTH LANGLEY AV,9035 SOUTH LANGLEY AV,9035 SOUTH LANGLEY AV,CHICAGO,IL,60619,"9035 SOUTH LANGLEY AVE, CHICAGO, IL 60619",4409,4409.0,,2001.0,1,1,1,0,0,0,0,0,0,0,0,0,0,0,0,0,HS,"9035, South Langley Avenue, Dauphin Park, Chatham, Chicago, Cook County, Illinois, 60619, United States of America","41.7299675, -87.60673753205626",41.7299675,-87.60673753205617,POINT (449539.4509377276 4619973.375595174),0,0,0,0,0,12,0,0,0,0,0,0,0,0,0,0,0,0,0,,3841 S Vincennes Av,"3841 S Vincennes Av, Chicago, IL",Chicago,IL,Ida B. Wells Homes,"South Vincennes Avenue, Park Manor, Greater Grand Crossing, Chicago, Cook County, Illinois, 60620, United States of America","41.7674384, -87.6270546",41.767438399999996,-87.6270546,4490.184259224427
1,NCES,,,,1.71E+11,0,0,1,0,0,0,1,0,0,HIGH SCHOOL TRANSITION CENTER C,OLIVE ACADEMY PREPARATION CENTER,OLIVE ACADEMY PREPARATION CENTER,4747 SOUTH UNION AV,5125 SOUTH PRINCETON AV,5125 SOUTH PRINCETON AV,CHICAGO,IL,60609,"5125 SOUTH PRINCETON AVE, CHICAGO, IL 60609",3704,8356.0,,2001.0,1,1,1,0,0,0,0,0,0,0,0,0,0,0,0,0,HS,"South Princeton Avenue, Armour Square, Chicago, Cook County, Illinois, 60609, United States of America","41.8256944, -87.6338166",41.8256944,-87.6338166,POINT (447365.6888787053 4630617.714407237),0,0,0,0,0,18,0,0,0,0,0,0,0,0,0,0,0,0,0,,3757 S Princeton Ave,"3757 S Princeton Ave, Chicago, IL",Chicago,IL,Wentworth Gardens,"3757, South Princeton Avenue, Armour Square, Chicago, Cook County, Illinois, 60609, United States of America","41.8259264, -87.63370933333333",41.8259264,-87.63370933,27.255708497920118
2,NCES,,,519.0,1.71E+11,0,0,1,0,0,0,1,0,0,RIIS ELEMENTARY SCHOOL,RIIS ELEMENTARY FULL SERVICE ACADEMY,RIIS ELEMENTARY FULL SERVICE ACADEMY,1018 SOUTH LYTLE ST,1018 SOUTH LYTLE ST,1018 SOUTH LYTLE ST,CHICAGO,IL,60607,"1018 SOUTH LYTLE ST, CHICAGO, IL 60607",2832,2832.0,,2001.0,1,1,1,0,0,0,0,0,0,0,0,0,0,0,0,0,ES,"1018, South Lytle Street, Near West Side, Chicago, Cook County, Illinois, 60607, United States of America","41.86916700146319, -87.6580799619605",41.869167001463104,-87.65807996196051,POINT (445387.7523745903 4635459.483702776),0,0,0,0,0,0,19,0,0,0,0,0,0,0,0,0,0,0,0,,1248 W Taylor St,"1248 W Taylor St, Chicago, IL",Chicago,IL,Jane Addams Homes,"1248, West Taylor Street, Near West Side, Illinois Medical District, Cook County, Illinois, 60607, United States of America","41.86930325338683, -87.65870544706566",41.86930325,-87.65870545,54.068654275154046
3,NCES,,,,1.71E+11,0,0,1,0,0,0,1,0,0,DYETT MIDDLE SCHOOL,DYETT MIDDLE SCHOOL,DYETT MIDDLE SCHOOL,555 EAST 51ST ST,555 EAST 51ST ST,555 EAST 51ST ST,CHICAGO,IL,60615,"555 EAST 51ST ST, CHICAGO, IL 60615",4001,8361.0,,2001.0,1,1,1,0,0,0,0,0,0,0,0,0,0,0,0,0,HS,"555, East 51st Street, Washington Park, Chicago, Cook County, Illinois, 60615, United States of America","41.80116635, -87.61286073249703",41.80116635,-87.61286073249698,POINT (449086.5225086607 4627881.83815724),0,158,0,0,0,0,0,0,0,0,0,0,0,0,0,0,0,0,0,,5201 S Federal St,"5201 S Federal St, Chicago, IL",Chicago,IL,Robert Taylor Homes,"5201, South Federal Street, Washington Park, Chicago, Cook County, Illinois, 60609, United States of America","41.799545884174705, -87.62780916885872",41.79954588,-87.62780917,1254.8618437864545
4,NCES,,,,1.71E+11,0,0,1,0,0,0,1,0,0,PICCOLO MIDDLE SCHOOL,PICCOLO MIDDLE SCHOOL,PICCOLO MIDDLE SCHOOL,1040 NORTH KEELER AV,1040 NORTH KEELER AV,1040 NORTH KEELER AV,CHICAGO,IL,60651,"1040 NORTH KEELER AVE, CHICAGO, IL 60651",2313,8421.0,,2001.0,1,1,1,0,0,0,0,0,0,0,0,0,0,0,0,0,MS,"Brian Piccolo Specialty School, 1040, North Keeler Avenue, Beat 2534, Humboldt Park, Chicago, Cook County, Illinois, 60651, United States of America","41.9003099, -87.732001",41.9003099,-87.732001,POINT (439282.7078864523 4638966.876011294),0,0,0,0,0,0,134,0,0,0,0,0,0,0,0,0,0,0,0,,714 W Division St,"714 W Division St, Chicago, IL",Chicago,IL,William Green Homes,"West Division Street, Moreland, Austin, Chicago, Cook County, Illinois, 60651, United States of America","41.9024164, -87.7424231",41.9024164,-87.7424231,895.5852631563345
5,NCES,,,,1.71E+11,0,0,1,0,0,0,1,0,0,NEAR NORTH CAREER METROPOLITAN HIGH SCHOOL,NEAR NORTH CAREER METROPOLITAN HIGH SCHOOL,NEAR NORTH CAREER METROPOLITAN HIGH SCHOOL,1450 NORTH LARRABEE ST,1450 NORTH LARRABEE ST,1450 NORTH LARRABEE ST,CHICAGO,IL,60610,"1450 NORTH LARRABEE ST, CHICAGO, IL 60610",805,8422.0,,2001.0,1,1,1,0,0,0,0,0,0,0,0,0,0,0,0,0,HS,"Near North Career High School, 1450, North Larrabee Street, Lincoln Park, Chicago, Cook County, Illinois, 60610, United States of America","41.9084395, -87.64381915496875",41.9084395,-87.6438191549687,POINT (446603.9385056735 4639810.835419286),0,0,0,0,0,144,0,0,0,0,0,0,0,0,0,0,0,0,0,,1340 N Larrabee St,"1340 N Larrabee St, Chicago, IL",Chicago,IL,William Green Homes,"1340, North Larrabee Street, Chicago River North, Near North Side, Chicago, Cook County, Illinois, 60610, United States of America","41.90564317650747, -87.64338600864538",41.90564318,-87.64338601,312.5496097003318
6,NCES,,,,1.71E+11,0,0,1,0,0,0,1,0,0,GRAPHIC COMMUNICATION ARTS HIGH SCHOOL,FUTURE COMMONS TECHNICAL PREP HIGH SCHOOL,FUTURE COMMONS TECHNICAL PREP HIGH SCHOOL,4071 SOUTH LAKE PARK,4071 SOUTH LAKE PARK AV,4071 SOUTH LAKE PARK AV,CHICAGO,IL,60653,"4071 SOUTH LAKE PARK AVE, CHICAGO, IL 60653",3604,8364.0,,2002.0,1,1,1,1,0,0,0,0,0,0,0,0,0,0,0,0,HS,"4071, South Lake Park Avenue, Oakland, Chicago, Cook County, Illinois, 60653, United States of America","41.8206919, -87.60090291689158",41.8206919,-87.6009029168915,POINT (450095.0815252453 4630042.665657275),0,0,19,0,0,0,0,0,0,0,0,0,0,0,0,0,0,0,0,,820 E Pershing Rd,"820 E Pershing Rd, Chicago, IL",Chicago,IL,Madden Park Homes,"820, East Pershing Road, Oakland, Chicago, Cook County, Illinois, 60653, United States of America","41.824724258272276, -87.60436836700478",41.82472426,-87.60436837,532.2351323254663
7,NCES,,,,1.71E+11,0,0,1,0,0,0,1,0,0,TEACHER PREPARATION HIGH SCHOOL,FUTURE COMMONS PROF PREPARATION H,FUTURE COMMONS PROF PREPARATION H,4071 SOUTH LAKE PARK,4071 SOUTH LAKE PARK AV,4071 SOUTH LAKE PARK AV,CHICAGO,IL,60653,"4071 SOUTH LAKE PARK AVE, CHICAGO, IL 60653",3604,8364.0,,2002.0,1,1,1,1,0,0,0,0,0,0,0,0,0,0,0,0,HS,"4071, South Lake Park Avenue, Oakland, Chicago, Cook County, Illinois, 60653, United States of America","41.8206919, -87.60090291689158",41.8206919,-87.6009029168915,POINT (450095.0815252453 4630042.665657275),0,0,19,0,0,0,0,0,0,0,0,0,0,0,0,0,0,0,0,,820 E Pershing Rd,"820 E Pershing Rd, Chicago, IL",Chicago,IL,Madden Park Homes,"820, East Pershing Road, Oakland, Chicago, Cook County, Illinois, 60653, United States of America","41.824724258272276, -87.60436836700478",41.82472426,-87.60436837,532.2351323254663
8,NCES,3.0,,392.0,1.71E+11,0,0,1,0,0,0,1,1,0,TERRELL ELEMENTARY SCHOOL,TERRELL ELEMENTARY SCHOOL,TERRELL ELEMENTARY SCHOOL,5410 SOUTH STATE ST,5410 SOUTH STATE ST,5410 SOUTH STATE ST,CHICAGO,IL,60609,"5410 SOUTH STATE ST, CHICAGO, IL 60609",4002,8361.0,,2002.0,1,1,1,1,0,0,0,0,0,0,0,0,0,0,0,0,ES,"ACE Technical Charter High School, 5410, South State Street, Washington Park, Chicago, Cook County, Illinois, 60609, United States of America","41.79601355, -87.62632862689821",41.79601355,-87.62632862689821,POINT (447963.5021564749 4627317.809959446),0,157,0,0,0,0,0,0,0,0,0,0,0,0,0,0,0,0,0,,5247 S Federal St,"5247 S Federal St, Chicago, IL",Chicago,IL,Robert Taylor Homes,"5247, South Federal Street, Washington Park, Chicago, Cook County, Illinois, 60609, United States of America","41.79885778797182, -87.62779024990233",41.79885779,-87.62779025,338.3359005821275
9,NCES,2.0,,652.0,1.71E+11,0,0,1,0,0,0,1,1,0,WILLIAMS ELEMENTARY SCHOOL,WILLIAMS ELEMENTARY SCHOOL,WILLIAMS ELEMENTARY SCHOOL,2710 SOUTH DEARBORN ST,2710 SOUTH DEARBORN ST,2710 SOUTH DEARBORN ST,CHICAGO,IL,60616,"2710 SOUTH DEARBORN ST, CHICAGO, IL 60616",3504,3504.0,,2002.0,1,1,1,1,0,0,0,0,0,0,0,0,0,0,0,0,MS,"Williams Elementary School, 2710, South Dearborn Street, Dearborn Homes, Douglas, Chicago, Cook County, Illinois, 60616, United States of America","41.84342485, -87.6286966970514",41.84342485,-87.6286966970514,POINT (447805.2729153804 4632583.138363315),0,0,0,203,0,0,0,0,0,0,0,0,0,0,0,0,0,0,0,,2822 S Calumet Av,"2822 S Calumet Av, Chicago, IL",Chicago,IL,Prairie Courts Extension,"2822, South Calumet Avenue, South Park Plaza, Douglas, Chicago, Cook County, Illinois, 60616, United States of America","41.842568, -87.618892",41.842568,-87.618892,819.5619753450363
10,NCES,,,325.0,1.71E+11,0,0,0,0,1,0,0,0,0,HOPE ELEMENTARY COMMUNITY ACADEMY,HOPE COLLEGE PREP HIGH SCHOOL,JOHN HOPE COLLEGE PREPARATORY HIGH SCHOOL,5515 SOUTH LOWE AV,5515 SOUTH LOWE AV,5515 SOUTH LOWE AV,CHICAGO,IL,60621,"5515 SOUTH LOWE AVE, CHICAGO, IL 60621",6803,8347.0,,2002.0,1,1,1,1,1,1,1,1,1,1,1,1,1,1,1,1,HS,"South Lowe Avenue, Becks Park, Englewood, Chicago, Cook County, Illinois, 60621, United States of America","41.7670751, -87.6407854",41.7670751,-87.6407854,POINT (446738.4595087647 4624113.758851835),0,0,0,0,0,12,0,0,0,0,0,0,0,0,0,0,0,0,0,,3841 S Vincennes Av,"3841 S Vincennes Av, Chicago, IL",Chicago,IL,Ida B. Wells Homes,"South Vincennes Avenue, Park Manor, Greater Grand Crossing, Chicago, Cook County, Illinois, 60620, United States of America","41.7674384, -87.6270546",41.767438399999996,-87.6270546,1142.0381017831833
11,NCES,,,,1.71E+11,0,0,1,0,0,0,1,0,0,RECOVERING THE GIFTED CHILD ELEMENTARY,RECOVERING THE GIFTED CHILD ELEMENTARY,RECOVERING THE GIFTED CHILD ELEMENTARY,3030 WEST ARTHINGTON ST,2221 SOUTH LAWNDALE AV,2221 SOUTH LAWNDALE AV,CHICAGO,IL,60623,"2221 SOUTH LAWNDALE AVE, CHICAGO, IL 60623",3006,3006.0,,2003.0,1,1,1,1,1,0,0,0,0,0,0,0,0,0,0,0,MS,"Paderewski Elementary School, 2221, South Lawndale Avenue, North Lawndale, Chicago, Cook County, Illinois, 60623, United States of America","41.8511436, -87.7169991",41.8511436,-87.7169991,POINT (440481.4763320888 4633497.560293153),0,0,0,75,0,0,0,0,0,0,0,0,0,0,0,0,0,0,0,,1224 W Roosevelt Rd,"1224 W Roosevelt Rd, Chicago, IL",Chicago,IL,Jane Addams Homes,"West Roosevelt Road, North Lawndale, Chicago, Cook County, Illinois, 60624, United States of America","41.8662079, -87.7225376",41.8662079,-87.7225376,1734.6314496335817
12,NCES,4.0,,,1.71E+11,0,0,1,0,0,0,1,0,0,ARTS OF LIVING ALTERNATIVE HIGH SCHOOL,ARTS OF LIVING ALTERNATIVE HIGH SCHOOL,ARTS OF LIVING ALTERNATIVE HIGH SCHOOL,721 NORTH LASALLE DR,1855 NORTH SHEFFIELD AV,1855 NORTH SHEFFIELD AV,CHICAGO,IL,60614,"1855 NORTH SHEFFIELD AVE, CHICAGO, IL 60614",719,8326.0,,2003.0,1,1,1,1,1,0,0,0,0,0,0,0,0,0,0,0,HS,"1855, North Sheffield Avenue, Chicago River North, Lincoln Park, Chicago, Cook County, Illinois, 60614, United States of America","41.915542, -87.653169",41.915542,-87.653169,POINT (445834.497382681 4640605.273975839),0,0,0,0,0,144,0,0,0,0,0,0,0,0,0,0,0,0,0,,1340 N Larrabee St,"1340 N Larrabee St, Chicago, IL",Chicago,IL,William Green Homes,"1340, North Larrabee Street, Chicago River North, Near North Side, Chicago, Cook County, Illinois, 60610, United States of America","41.90564317650747, -87.64338600864538",41.90564318,-87.64338601,1366.1200798887005
13,NCES,,,,1.71E+11,0,0,1,0,0,0,1,0,0,HIGH SCHOOL TRANSITITION CENTER A,RODRIGUEZ ACADEMY PREPARATION CT,RODRIGUEZ ACADEMY PREPARATION CT,630 WEST IRVING PARK RD,5900 NORTH GLENWOOD AV,5900 NORTH GLENWOOD AV,CHICAGO,IL,60660,"5900 NORTH GLENWOOD AVE, CHICAGO, IL 60660",305,305.0,,2003.0,1,1,1,1,1,0,0,0,0,0,0,0,0,0,0,0,HS,"Nicholas Senn High School, 5900, North Glenwood Avenue, Edgewater Glen, Edgewater, Chicago, Cook County, Illinois, 60660, United States of America","41.988987, -87.6667677818856",41.988987,-87.66676778188558,POINT (444770.2245827672 4648768.457855179),0,0,0,0,0,144,0,0,0,0,0,0,0,0,0,0,0,0,0,,1340 N Larrabee St,"1340 N Larrabee St, Chicago, IL",Chicago,IL,William Green Homes,"1340, North Larrabee Street, Chicago River North, Near North Side, Chicago, Cook County, Illinois, 60610, United States of America","41.90564317650747, -87.64338600864538",41.90564318,-87.64338601,9454.594836723862
14,NCES,,,,1.71E+11,0,0,1,0,0,0,1,0,0,STUDENT BUILDERS CHARTER HIGH SCHOOL,PARTEE ACADEMY PREPARATION CENTER,PARTEE ACADEMY PREPARATION CENTER,3301 WEST FRANKLIN BL,8101 SOUTH LA SALLE ST,8101 SOUTH LASALLE ST,CHICAGO,IL,60620,"8101 SOUTH LASALLE ST, CHICAGO, IL 60620",4404,8424.0,,2003.0,1,1,1,1,1,0,0,0,0,0,0,0,0,0,0,0,HS,"South LaSalle Street, Loop, Chicago, Cook County, Illinois, 60696, United States of America","41.8791456, -87.6322586",41.8791456,-87.6322586,POINT (447538.7670025357 4636551.273873079),0,0,0,21,0,0,0,0,0,0,0,0,0,0,0,0,0,0,0,,1240 W Roosevelt Rd,"1240 W Roosevelt Rd, Chicago, IL",Chicago,IL,Jane Addams Homes,"West Roosevelt Road, Greektown, Near West Side, Chicago, Cook County, Illinois, 60607, United States of America","41.8672794, -87.6423234",41.8672794,-87.64232340000001,1559.9433978863005
15,NCES,,,,1.71E+11,0,0,1,0,0,0,1,0,0,HIGH SCHOOL TRANSITION CENTER D,SENGSTACKE ACADEMY PREPARATION C,SENGSTACKE ACADEMY PREPARATION C,2641 SOUTH CALUMET,2641 SOUTH CALUMET AV,2641 SOUTH CALUMET AV,CHICAGO,IL,60616,"2641 SOUTH CALUMET AVE, CHICAGO, IL 60616",3502,8392.0,,2003.0,1,1,1,1,1,0,0,0,0,0,0,0,0,0,0,0,HS,"2641, South Calumet Avenue, South Park Plaza, Douglas, Chicago, Cook County, Illinois, 60616, United States of America","41.84443435, -87.61837744283874",41.84443435,-87.6183774428387,POINT (448662.7935310446 4632688.999789421),0,0,0,203,0,0,0,0,0,0,0,0,0,0,0,0,0,0,0,,2822 S Calumet Av,"2822 S Calumet Av, Chicago, IL",Chicago,IL,Prairie Courts Extension,"2822, South Calumet Avenue, South Park Plaza, Douglas, Chicago, Cook County, Illinois, 60616, United States of America","41.842568, -87.618892",41.842568,-87.618892,211.5774853474585
16,NCES,,,,1.71E+11,0,0,1,0,0,0,1,0,0,HIGH SCHOOL TRANSITION CENTER B,HARVEY ACADEMY PREPARATION CENTER,HARVEY ACADEMY PREPARATION CENTER,2250 NORTH MCVICKER AV,730 NORTH PULASKI RD,730 NORTH PULASKI RD #8,CHICAGO,IL,60624,"730 NORTH PULASKI RD, CHICAGO, IL 60624",2314,8421.0,,2003.0,1,1,1,1,1,0,0,0,0,0,0,0,0,0,0,0,HS,"730, North Pulaski Road, Humboldt Park, Chicago, Cook County, Illinois, 60624, United States of America","41.8941562, -87.7268669848285",41.8941562,-87.72686698482849,POINT (439702.7730725784 4638280.023059447),0,0,0,0,0,0,134,0,0,0,0,0,0,0,0,0,0,0,0,,714 W Division St,"714 W Division St, Chicago, IL",Chicago,IL,William Green Homes,"West Division Street, Moreland, Austin, Chicago, Cook County, Illinois, 60651, United States of America","41.9024164, -87.7424231",41.9024164,-87.7424231,1583.1500948599044
17,NCES,,,,1.71E+11,0,0,1,0,0,0,1,0,0,TESLA ALT HIGH SCHOOL FOR PREG GIRLS,TESLA ALT HIGH SCHOOL FOR PREG GIRLS,TESLA ALT HIGH SCHOOL FOR PREG GIRLS,6657 SOUTH KIMBARK AV,6657 SOUTH KIMBARK AV,6657 SOUTH KIMBARK AV,CHICAGO,IL,60637,"6657 SOUTH KIMBARK AVE, CHICAGO, IL 60637",4210,8344.0,,2003.0,1,1,1,1,1,0,0,0,0,0,0,0,0,0,0,0,HS,"6657, South Kimbark Avenue, Woodlawn, Chicago, Cook County, Illinois, 60637, United States of America","41.77377165, -87.59416360499378",41.77377165,-87.59416360499371,POINT (450618.7764293208 4624829.424506069),0,0,0,0,0,12,0,0,0,0,0,0,0,0,0,0,0,0,0,,3740 S Cottage Grove Ave,"3740 S Cottage Grove Ave, Chicago, IL",Chicago,IL,Ida B. Wells Homes,"South Cottage Grove Avenue, Washington Park, Chicago, Cook County, Illinois, 60637, United States of America","41.7862906, -87.6060534",41.7862906,-87.60605340000001,1705.3769886803752
18,NCES,,,,1.71E+11,0,0,1,0,0,0,1,0,0,HIGH SCHOOL TRANSITION CENTER E,HAYES ACADEMY PREPARATION CENTER,HAYES ACADEMY PREPARATION CENTER,6800 SOUTH STEWART AV,6533 SOUTH STEWART AV,6533 SOUTH STEWART AV,CHICAGO,IL,60621,"6533 SOUTH STEWART AVE, CHICAGO, IL 60621",6809,6809.0,,2003.0,1,1,1,1,1,0,0,0,0,0,0,0,0,0,0,0,HS,"6533, South Stewart Avenue, Becks Park, Englewood, Chicago, Cook County, Illinois, 60621, United States of America","41.7755057, -87.63447577603672",41.7755057,-87.6344757760367,POINT (447269.8176567735 4625045.879990928),0,0,0,0,158,0,0,0,0,0,0,0,0,0,0,0,0,0,0,,4946 S State St,"4946 S State St, Chicago, IL",Chicago,IL,Robert Taylor Homes,"South State Street, Park Manor, Greater Grand Crossing, Chicago, Cook County, Illinois, 60621, United States of America","41.774062, -87.6252276",41.774062,-87.6252276,785.1684376187953
19,NCES,5.0,,429.0,1.71E+11,0,0,1,0,0,0,1,0,0,MUNOZ MARIN PRIMARY CENTER,MUNOZ MARIN PRIMARY CENTER,MUNOZ MARIN PRIMARY CENTER,3320 WEST EVERGREEN AV,3320 WEST EVERGREEN AV,3320 WEST EVERGREEN AV,CHICAGO,IL,60651,"3320 WEST EVERGREEN AVE, CHICAGO, IL 60651",2309,2309.0,,2003.0,1,1,1,1,1,0,0,0,0,0,0,0,0,0,0,0,ES,"3312-3320, West Evergreen Avenue, Beat 2535, Humboldt Park, Chicago, Cook County, Illinois, 60651, United States of America","41.905796499999994, -87.71018641823045",41.9057964999999,-87.7101864182304,POINT (441097.2156448167 4639560.832331642),0,0,0,0,0,0,134,0,0,0,0,0,0,0,0,0,0,0,0,,714 W Division St,"714 W Division St, Chicago, IL",Chicago,IL,William Green Homes,"West Division Street, Moreland, Austin, Chicago, Cook County, Illinois, 60651, United States of America","41.9024164, -87.7424231",41.9024164,-87.7424231,2700.0987990009307
20,NCES,7.0,,97.0,1.71E+11,0,0,1,0,0,0,1,1,0,WOODSON NORTH ELEMENTARY SCHOOL,WOODSON NORTH ELEMENTARY SCHOOL,WOODSON NORTH ELEMENTARY SCHOOL,4414 SOUTH EVANS AV,4414 SOUTH EVANS AV,4414 SOUTH EVANS AV,CHICAGO,IL,60653,"4414 SOUTH EVANS AVE, CHICAGO, IL 60653",3810,8360.0,,2003.0,1,1,1,1,1,0,0,0,0,0,0,0,0,0,0,0,MS,"4414-4444, South Evans Avenue, Forestville, Grand Boulevard, Chicago, Cook County, Illinois, 60653, United States of America","41.814065049999996, -87.60869678533442",41.814065049999904,-87.60869678533442,POINT (449442.587022907 4629311.469015368),0,158,0,0,0,0,0,0,0,0,0,0,0,0,0,0,0,0,0,,4445 S Evans Av,"4445 S Evans Av, Chicago, IL",Chicago,IL,Washington Park,"4445, South Evans Avenue, Forestville, Grand Boulevard, Chicago, Cook County, Illinois, 60653, United States of America","41.81413920570469, -87.60818968596692",41.81413921,-87.60818969,42.91703023454583
21,NCES,,7.1,140.0,1.71E+11,0,0,0,0,1,0,0,0,0,CUFFE ELEMENTARY SCHOOL,CUFFE MATH-SCI TECH ELEMENTARY ACADEMY,CUFFE MATH-SCI TECH ELEMENTARY ACADEMY,1540 WEST 84TH ST,8324 SOUTH RACINE AV,1540 WEST 84TH ST,CHICAGO,IL,60620,"1540 WEST 84TH ST, CHICAGO, IL 60620",7111,7111.0,,2003.0,1,1,1,1,1,1,1,1,1,1,1,1,1,1,1,1,ES,"1540, West 84th Street, South Englewood, Auburn Gresham, Chicago, Cook County, Illinois, 60620, United States of America","41.741578849999996, -87.66224019318365",41.741578849999904,-87.66224019318359,POINT (444933.3569997765 4621296.547111774),0,0,0,0,0,12,0,0,0,0,0,0,0,0,0,0,0,0,0,,3841 S Vincennes Av,"3841 S Vincennes Av, Chicago, IL",Chicago,IL,Ida B. Wells Homes,"South Vincennes Avenue, Park Manor, Greater Grand Crossing, Chicago, Cook County, Illinois, 60620, United States of America","41.7674384, -87.6270546",41.767438399999996,-87.6270546,4098.851276751122
22,NCES,8.0,,662.0,1.71E+11,0,0,1,0,0,0,1,0,0,COLMAN ELEMENTARY SCHOOL,ZENOS COLMAN ELEMENTARY SCHOOL,ZENOS COLMAN ELEMENTARY SCHOOL,4655 SOUTH DEARBORN ST,4655 SOUTH DEARBORN ST,4655 SOUTH DEARBORN ST,CHICAGO,IL,60609,"4655 SOUTH DEARBORN ST, CHICAGO, IL 60609",3816,8357.0,,2003.0,1,1,1,1,1,0,0,0,0,0,0,0,0,0,0,0,ES,"Zenos Colman Elementary School, 4655, South Dearborn Street, Grand Boulevard, Chicago, Cook County, Illinois, 60609, United States of America","41.8101164, -87.6268680444687",41.8101164,-87.62686804446871,POINT (447930.1057304538 4628883.916644288),323,0,0,0,0,0,0,0,0,0,0,0,0,0,0,0,0,0,0,,4845 S Federal St,"4845 S Federal St, Chicago, IL",Chicago,IL,Robert Taylor Homes,"4845, South Federal Street, Washington Park, Chicago, Cook County, Illinois, 60609, United States of America","41.80881049411765, -87.628466",41.80881049,-87.628466,196.57667020298942
23,NCES,9.0,,231.0,1.71E+11,0,0,1,0,0,0,1,0,0,DONOGHUE ELEMENTARY SCHOOL,DONOGHUE ELEMENTARY SCHOOL,DONOGHUE ELEMENTARY SCHOOL,707 EAST 37TH ST,707 EAST 37TH ST,707 EAST 37TH ST,CHICAGO,IL,60653,"707 EAST 37TH ST, CHICAGO, IL 60653",3603,8365.0,,2003.0,1,1,1,1,1,0,0,0,0,0,0,0,0,0,0,0,ES,"707, East 37th Street, Oakland, Chicago, Cook County, Illinois, 60653, United States of America","41.8273919, -87.60810700502543",41.8273919,-87.6081070050254,POINT (449502.0453173979 4630790.750128281),0,0,0,0,0,10,0,0,0,0,0,0,0,0,0,0,0,0,0,,679 E 37th St,"679 E 37th St, Chicago, IL",Chicago,IL,Ida B. Wells Homes,"679, East 37th Street, Oakland, Chicago, Cook County, Illinois, 60653, United States of America","41.82750058489981, -87.60929103093851",41.82750058,-87.60929103,99.0633415588869
24,NCES,10.0,,,1.71E+11,0,0,1,0,0,0,1,1,0,SOUTH SHORE COMMUNITY ACADEMY HIGH SCHOOL,SOUTH SHORE COMMUNITY ACADEMY HIGH SCHOOL,SOUTH SHORE COMMUNITY ACADEMY HIGH SCHOOL,7529 SOUTH CONSTANCE AV,7527 SOUTH CONSTANCE AV,7529 SOUTH CONSTANCE AV,CHICAGO,IL,60649,"7529 SOUTH CONSTANCE AVE, CHICAGO, IL 60649",4311,8342.0,,2003.0,1,1,1,1,1,0,0,0,0,0,0,0,0,0,0,0,HS,"7529, South Constance Avenue, South Shore, Chicago, Cook County, Illinois, 60649, United States of America","41.75793485844594, -87.57968308187196",41.75793485844591,-87.5796830818719,POINT (451810.4148779791 4623062.932060279),0,0,0,0,0,12,0,0,0,0,0,0,0,0,0,0,0,0,0,,3740 S Cottage Grove Ave,"3740 S Cottage Grove Ave, Chicago, IL",Chicago,IL,Ida B. Wells Homes,"South Cottage Grove Avenue, Washington Park, Chicago, Cook County, Illinois, 60637, United States of America","41.7862906, -87.6060534",41.7862906,-87.60605340000001,3836.0753893257515
25,NCES,12.0,,601.0,1.71E+11,1,0,1,0,0,0,1,0,0,THOMAS JEFFERSON ELEMENTARY SCHOOL,THOMAS JEFFERSON ELEMENTARY SCHOOL,THOMAS JEFFERSON ELEMENTARY SCHOOL,1522 WEST FILLMORE ST,1522 WEST FILLMORE ST,1522 WEST FILLMORE ST,CHICAGO,IL,60607,"1522 WEST FILLMORE ST, CHICAGO, IL 60607",2831,2831.0,,2004.0,1,1,1,1,1,1,0,0,0,0,0,0,0,0,0,0,ES,"1522, West Fillmore Street, Near West Side, Chicago, Cook County, Illinois, 60607, United States of America","41.86873995, -87.66486861824593",41.86873995,-87.6648686182459,POINT (444824.0104118693 4635416.410642243),0,0,0,0,0,0,10,0,0,0,0,0,0,0,0,0,0,0,0,,1300 W Taylor St,"1300 W Taylor St, Chicago, IL",Chicago,IL,Jane Addams Homes,"1300, West Taylor Street, Near West Side, Illinois Medical District, Cook County, Illinois, 60607, United States of America","41.869443, -87.660279",41.869443,-87.660279,388.80999752011286
26,NCES,,,516.0,1.71E+11,0,0,1,0,0,0,1,0,0,WRIGHT ELEMENTARY SCHOOL,WRIGHT ELEMENTARY SCHOOL,WRIGHT ELEMENTARY SCHOOL,627 NORTH HARDING AV,627 NORTH HARDING AV,627 NORTH HARDING AV,CHICAGO,IL,60624,"627 NORTH HARDING AVE, CHICAGO, IL 60624",2315,2315.0,,2004.0,1,1,1,1,1,1,0,0,0,0,0,0,0,0,0,0,ES,"627, North Harding Avenue, Beat 2535, Humboldt Park, Chicago, Cook County, Illinois, 60624, United States of America","41.892172759156566, -87.724658",41.892172759156495,-87.724658,POINT (439884.1604946691 4638058.255995623),0,0,0,0,0,0,134,0,0,0,0,0,0,0,0,0,0,0,0,,714 W Division St,"714 W Division St, Chicago, IL",Chicago,IL,William Green Homes,"West Division Street, Moreland, Austin, Chicago, Cook County, Illinois, 60651, United States of America","41.9024164, -87.7424231",41.9024164,-87.7424231,1861.554972578712
27,NCES,,,,1.71E+11,0,0,1,0,0,0,1,0,0,DOOLITTLE INTERMED & UPPER SCHOOL,DOOLITTLE EAST MIDDLE SCHOOL,DOOLITTLE EAST MIDDLE SCHOOL,535 EAST 35TH ST,535 EAST 35TH ST,535 EAST 35TH ST,CHICAGO,IL,60616,"535 EAST 35TH ST, CHICAGO, IL 60616",3511,3511.0,,2004.0,1,1,1,1,1,1,0,0,0,0,0,0,0,0,0,0,MS,"East 35th Street, Douglas, Chicago, Cook County, Illinois, 60616, United States of America","41.831246, -87.6144915",41.831246,-87.6144915,POINT (448974.9274689039 4631222.428889486),0,0,0,0,0,0,10,0,0,0,0,0,0,0,0,0,0,0,0,,3709 S Vincennes Ave,"3709 S Vincennes Ave, Chicago, IL",Chicago,IL,Ida B. Wells Homes,"3709, South Vincennes Avenue, Oakland, Chicago, Cook County, Illinois, 60653, United States of America","41.82722372344076, -87.61160015551626",41.82722372,-87.61160016,507.0414447758449
28,NCES,18.0,,,1.71E+11,0,0,1,0,0,0,1,0,0,BYRD ELEMENTARY COMMUNITY ACADEMY,BYRD ELEMENTARY COMMUNITY ACADEMY,BYRD ELEMENTARY COMMUNITY ACADEMY,363 WEST HILL ST,363 WEST HILL ST,363 WEST HILL ST,CHICAGO,IL,60610,"363 WEST HILL ST, CHICAGO, IL 60610",808,8383.0,,2004.0,1,1,1,1,1,1,0,0,0,0,0,0,0,0,0,0,ES,"363, West Hill Street, Chicago River North, Near North Side, Chicago, Cook County, Illinois, 60610, United States of America","41.901983, -87.63765655102041",41.901983,-87.63765655102041,POINT (447109.7164795164 4639090.166705254),0,0,65,0,0,0,0,0,0,0,0,0,0,0,0,0,0,0,0,,1158 N Cleveland Av,"1158 N Cleveland Av, Chicago, IL",Chicago,IL,Frances Cabrini Homes,"1158, North Cleveland Avenue, Parkside of Old Town, Near North Side, Chicago, Cook County, Illinois, 60610, United States of America","41.90306093103448, -87.64129837931034",41.90306093,-87.64129838,324.9233917037753
